Topic,Topic summary,Topic description,Count,% of corpus
201,Early Phonics and Sight Words,"Guidance for teaching early reading: start with letter sounds, progress to CVC/CVCE, digraphs/diphthongs and vowel teams, introduce sight words, use short, consistent practice with praise and leveled books.",45,0.025
202,Machine Learning Hype vs Reality,"Debates on ML/AI hype, clarifying ML as statistics-based modeling, distinctions from AI, branding concerns, mainstreaming via big data/compute, and rapid but unevenly understood growth and practical impact.",45,0.025
203,Learning Programming and Early Career Advice,"Personal experiences and pragmatic advice on learning programming: choosing languages, realistic time commitment, building projects, avoiding burnout, and setting expectations for first jobs and interviews, especially for self-taught learners.",45,0.025
204,AI Chatbots & Suicide,"Debate over AI chatbots’ role in suicide cases—misuse as therapists, ethical risks, user/parent responsibility, and whether Character.AI interactions contribute to or mitigate suicidal behavior.",45,0.025
205,Discord-based programming mentorship and study groups,"Posts seeking or offering free programming tutoring, mentorship, or study partners—often for beginners in Python and web dev—coordinated via Discord/DMs with flexible schedules.",45,0.025
206,Game Development Careers and Graphics,"Advice on entering game development: competitive entry-level market, importance of strong graphics skills and portfolios, degrees vs self-directed learning, alternative routes via non-game software, AR/VR and ML relevance.",44,0.025
207,AR/VR Industry & Careers,"Discussion of AR/VR state: hardware limitations, niche adoption, headsets/glasses, skills (Unity, shaders, CV, multiplayer), shifting from gaming to training/enterprise use; potential growth with improved wearable devices.",44,0.025
208,Online CS Master’s (OMSCS) vs On-Campus,"Pros and cons of online CS master's programs (e.g., Georgia Tech OMSCS) versus on-campus; pathways from non-CS backgrounds, employer tuition, costs, and aims in AI, software, and data science.",43,0.024
209,"ChatGPT vs Claude vs Gemini (study, coding, PDF, pricing)",Users compare assistants: ChatGPT preferred for studying; Claude favored for coding; discuss Gemini and Perplexity; issues with PDF export and extensions; ask about student pricing and plan differences.,43,0.024
210,PhD vs MSc Decisions in Cognitive Neuroscience/AI,"Students weigh funded clinical neuro PhDs against self-funded cognitive science/AI master’s, balancing research fit, industry prospects, timelines, and funding, seeking guidance on labs and career paths.",43,0.024
211,AI-Flattened Organizations,"AI enables flatter organizations by merging IC and management roles, automating reporting and decisions, reducing middle management and altering manager job prospects and layoffs.",43,0.024
212,TikTok Algorithm and Moderation,"How TikTok’s AI-driven recommendation system personalizes short-video feeds, creates rabbit holes, shapes teen behavior, and raises moderation challenges, compared with other social platforms; trends amplified via reactions.",42,0.024
213,Tech Sales Career Transitions,"Professionals pivoting into SaaS/tech sales, leveraging prior B2B experience and domain knowledge, exploring certifications and technical upskilling to pursue higher-paying roles like AE, sales engineer, or sales leadership.",42,0.024
214,Open Source Contribution Strategy for ML Engineers,"Guidance on selecting OSS projects, making meaningful contributions, integrating with work, and showcasing results on GitHub to build a portfolio and advance a machine learning engineering career.",42,0.024
215,George Hotz (geohot) & comma.ai,"American hacker famed for iPhone jailbreaks and PS3 hacks; sued by Sony; later founded comma.ai for vehicle automation/ML; emblematic of AI as a ""cool job.""",42,0.024
216,SQL Learning Resources and Platform Reviews,"Recommendations for mastering SQL via hands-on courses and exercises (Udemy, freeCodeCamp, LeetCode); look for window functions; criticism of DataLemur’s weak validation and ads; modest hardware suffices.",42,0.024
217,AI-Powered Personalized Learning,"AI tools personalize instruction, automate grading and admin, deliver analytics and virtual tutoring, enhance engagement and accessibility, and transform classrooms while raising considerations around ethics, privacy, and equitable access.",41,0.023
218,Data/IT career choices and AI reliability concerns,"Posts debating data science versus actuarial or IT studies, job prospects in tech, anxiety about market saturation, and critiques of GPT hallucinations undermining trust in academic or professional citations.",41,0.023
219,CS undergrads seeking internships and resume-building,"Underclass CS students seeking summer internships, worried about limited experience, comparing to peers; asking for resume-building strategies, personal projects, alternatives to internships, and career fair/elevator pitch tips.",41,0.023
220,CS Curriculum and Coursework,"Overview of CS degree: programming, data structures, algorithms, discrete math, theory of computation, architecture, languages, electives (AI, databases, OS), plus math requirements (calculus, linear algebra), varying by institution.",41,0.023
221,Debate over 'delve' as an AI buzzword,"Conversation about the word 'delve': some see it as AI-generated jargon; others note its long-standing use in gaming, archaeology, and media, predating ChatGPT, rejecting AI 'hijacking' claims.",41,0.023
222,Selecting a top CS/AI master’s: ETH vs alternatives,"Weighing ETH Zurich against UCL, TUM, Imperial and Canadian schools using rankings, costs, scholarships, location, and research/teaching fit for theoretical CS/AI master’s decisions.",40,0.022
223,Racial Bias in AI and Facial Recognition,"Discussion of AI bias, including racist outcomes in chatbots and facial recognition; references to Gebru, Bender, and Boulamwini; calls for caution, diverse data, and multi-source verification.",40,0.022
224,CS Career Path & Specialization,"Students seeking guidance on selecting CS specializations (web, ML, mobile, cybersecurity), self-paced learning strategies, interview/DSA preparation, and balancing coding with business-oriented roles.",39,0.022
225,Study Buddies and Accountability Sessions,"Seeking study partners and hosting online accountability sessions with icebreakers, AI-as-study-buddy tips, focus time, and resource sharing; open to all; DM to join.",39,0.022
226,ChatGPT impact on developer jobs and UBI,"Debate on ChatGPT automating software work: productivity gains may cut engineering hires, especially juniors; skepticism persists; concerns over Big Tech motives; calls for UBI and shifted developer roles.",39,0.022
227,Programming eBook Bundle Skepticism,"Users criticize Humble/Packt bundles and cookbook collections for low quality, redundancy, outdatedness; recommend buying single high-quality titles or alternative resources (Manning, O'Reilly, No Starch) instead.",39,0.022
228,"CS Coursework, Math, and AI Prep","Advice and discussion on computer science education: value of math/discrete structures and algorithms, choosing CS courses (intro, C/C++/Python), balancing theory with practical projects, and preparation for AI/ML and careers.",39,0.022
229,AI downvoting and responsible use,"Users note AI posts get downvoted in the sub; share resources and successes promoting responsible AI guidelines, education, and constructive applications despite prevailing negativity.",39,0.022
230,Math-Heavy Data Science and Machine Learning,"Emphasizes math/statistics foundations, Python/R skills, and proper model evaluation in data science and machine learning, contrasting theory vs applications and warning against superficial high scores from preprocessing errors.",39,0.022
231,CRUD vs Complex Software,"Debate on CRUD applications: definition, legitimacy, and engineering complexity. Many apps are CRUD, not pejorative; contrasted with computationally complex software. At scale, performance and systems concerns still require strong engineering.",39,0.022
232,Product Management vs Data Science Career Choices,"Professionals debating moves among PM, data science, and related roles, weighing pay, work-life balance, people interaction, growth ceilings, interview prep, and entrepreneurship ambitions.",38,0.021
233,Educational presentation tools and AI,"Comparisons of PowerPoint, Google Slides, Canva, Keynote, Prezi, and AI/interactive tools for designing, generating, and redesigning educational slides while preserving content and enabling streamlined online access.",38,0.021
234,Self-directed Web Development and CS Learning Roadmaps,"Posts outlining structured paths and resources (FreeCodeCamp, Odin Project) for HTML/CSS/JavaScript, Python, Node/React, CS fundamentals and DSA practice, emphasizing projects, interview prep, and managing AI dependency.",38,0.021
235,Career Transitions After Teaching Abroad,"Teachers with international experience exploring non-teaching careers, comparing pros/cons, stability, benefits, travel, and work-life balance while reassessing education’s viability and seeking secure, fulfilling paths.",37,0.021
236,Block AI Results in Search,"Suppress AI results: In Google, Tools > Verbatim hides AI overviews; on iPhone Safari, Customize Search Engine can block AI in Google; DuckDuckGo lets you disable its AI.",37,0.021
237,"Facebook and Big Tech: Innovation, Scale, and Privacy","Debate comparing Facebook and peers on innovation versus scale, product quality, user impact, data privacy, and the complexities of policy and content moderation in massive platforms.",37,0.021
238,AI in Engineering and QSAR,"Applying ML/AI (neural nets, random forests) to CFD/FEA and drug discovery QSAR; focus on descriptors, surrogate models, data quality, and validation.",37,0.021
239,AI Skepticism and Creative Displacement,"Discussions express fear and skepticism about AI, its encroachment on music and art, the difficulty distinguishing real from synthetic, and propose new human roles coordinating and filtering AI outputs.",37,0.021
240,AI permanence and rapid improvement,"Discussion asserts AI’s permanence and rapid advancement: heavy investment, mass deployment, and quick resolution of current errors; hopes AI prevents negative outcomes.",36,0.02
241,International MS Data Science Admissions Advice,"International applicants assess GPA, GRE, coursework, and DS experience to gauge chances and seek recommendations for target, reach, and safety universities for MS/Stats/CS programs.",36,0.02
242,Grammarly vs ChatGPT for Writing,"Debating and comparing Grammarly (Premium/Pro) with ChatGPT: grammar correction vs content generation, rewriting features, ethical concerns in graded writing, and practical usage recommendations.",36,0.02
243,AI vs ML vs Data Science,"Explains distinctions and overlaps: data science draws insights with statistics; machine learning is a tool and AI subset; current AI is task-specific, not general, suitable for certain problems.",36,0.02
244,AI Plagiarism Detection in Student Work,"Educators use AI detectors, document history, comparative writing samples, tailored prompts, source checks, and student interviews, escalating to academic offices, to gather evidence and address AI-generated papers.",36,0.02
245,Human-Centered AI in Education,"AI isn't going away, but schools should prioritize care, trust, fundamentals, and structural reform; resist venture-driven shortcuts; use AI appropriately to enhance relationships and learning for kids.",36,0.02
246,Rails vs Django/Python: Popularity and Jobs,"Discussion comparing Ruby on Rails and Python/Django/Flask: Rails jobs and developer experience versus Python’s AI/ML popularity, explaining Google Trends gaps and advising choice based on goals and use cases.",35,0.02
247,Breaking into CS/tech careers,"Advice-seeking on transitioning into CS: choosing bootcamp vs MS, filling skill gaps, competitive programming, portfolios, and strategies for internships and entry-level jobs from nontraditional or low-tier backgrounds.",35,0.02
248,AI/ML CS grad SOP review requests,"Applicants for MS in CS (AI/ML) soliciting harsh critique of Statements of Purpose, sharing program guidelines and requesting DM/comment reviews to strengthen fit presentation to admissions committees.",35,0.02
249,Profane Anti-AI Sentiment,"Intense hostility toward AI and AI detection tools, expressed through profanity and rejection; dismissive, angry tone, refusing to redo tasks.",35,0.02
250,Core CS Curriculum: DSA and Systems/OS,"Discussion of undergraduate CS coursework, stressing data structures and algorithms and systems/operating systems as most valuable for industry and interviews, with notes on variable course quality and application-focused electives.",35,0.02
251,Machine Learning Engineer Careers,"Machine learning engineer job role and career path: core ML skills, engineering responsibilities, and opportunities for engineers seeking or building a strong ML engineering career.",35,0.02
252,"US tech hubs: NYC, Chicago, Denver, Pittsburgh, Seattle","Comparing tech hubs’ opportunities, salaries, lifestyle, and cost of living across NYC, Chicago, Denver, Pittsburgh, Seattle; mentions companies (Bloomberg, Google), anchors (CMU), satellite offices, finance niches.",34,0.019
253,Job Shadowing Opportunities via Shadowing AI,"Promotes finding and pursuing company job shadowing positions to gain on-the-job experience, repeatedly encouraging use of Shadowing AI and continued searching for available shadowing roles.",34,0.019
254,Custom YouTube Course Playlists,"A free app that builds tailored courses from user outlines by curating expert YouTube videos, moving away from AI-generated lessons; seeking learner feedback on usefulness and desired features.",34,0.019
255,AI/ML as Buzzwords and Misconceptions,"Debate on AI/ML as overused buzzwords, widespread misconceptions, and hype versus reality—ML lacks true reasoning; critiques of inflated expectations and misapplied terms in industry projects.",34,0.019
256,Student outreach email requesting RA position in biology/machine learning lab,"High school student seeks research assistantship, citing biology and machine learning interests, professor's TEDx talk, and readiness to learn prerequisites; requests discussion of lab opportunities and potential contributions.",34,0.019
257,AI-Crypto Hype Cycle,"Critiques that AI mirrors past crypto/blockchain hype: FOMO-driven 'bro' culture, scams, GPU gold-rush enriching sellers, overblown promises, toxicity, and an inevitable plateau.",34,0.019
258,ChatGPT for Resume Tailoring & Interview Prep,"Using ChatGPT to tailor resumes and cover letters to job descriptions, generate interview questions and responses, highlight transferable skills, and plan follow-ups; plus practical onsite interview tips.",33,0.019
259,Teachers' AI Dilemma,"Teachers share frustration with AI errors and student misuse, debating policies and assessments, and whether to resist or accept AI to manage workload, enrollment, and grading.",33,0.019
260,Bypassing AI Detectors with WalterWrites Humanizer,"Users discuss unreliable AI detection (Turnitin, GPTZero) flagging formal writing and using Walter/WalterWrites humanizer to soften tone and evade false positives.",33,0.019
261,Data Science Influencer Hype vs Reality,"Debate over YouTube/MOOC influencers promoting ML-heavy advice, accused of harming young job seekers and peddling courses, versus defenders claiming shared experiences are valid; calls for industry-grounded guidance.",33,0.019
262,Project-Based EdTech and Online Learning Ecosystems,"Modern education is shifting to EdTech: AI/VR, data analytics, booming online learning, and project-based, decentralized platforms for intermediate learners delivering practical, career-focused upskilling worldwide.",33,0.019
263,Zongadetect AI Plagiarism Checker,"Promoting Zongadetect for students: a user-friendly plagiarism and AI-generated content detector offering a free trial, flexible pricing, and fast results to support thesis integrity and reduce academic stress.",33,0.019
264,Company AI Adoption Debate,"Debate within companies over AI value and mandates: some see productivity gains, others criticize forced usage and errors; discussion of tracking AI use, performance expectations, and prioritizing domain knowledge.",33,0.019
265,CS PhD Admissions Advice,"Guidance on CS/AI PhD admissions: prioritize research experience, publications, and faculty fit; craft a focused SOP and strong recommendations; GPA/GRE matter less; pursue undergraduate research, even outside exact interests.",32,0.018
266,"Paid Work, Gig Economy, and Surveys","Overview of paid employment and earning methods—from formal jobs to freelancing and Get-Paid-To survey sites—covering income, skills, gig economy trends, challenges, and considerations for career planning.",32,0.018
267,Programming Careers and Learning Paths,"Developers balancing jobs and study: self-taught coding, game-development ambitions, prioritizing skills, time management, and re-skilling for modern technologies and remote-friendly roles.",32,0.018
268,AI Bootcamps & Workplace Skills,"Intense, free, project-based AI bootcamps where grads clone apps (Slack, Zendesk, TikTok) weekly for jobs; emphasis on collaboration, listening, conflict resolution, and win-win teamwork in modern companies.",31,0.017
269,Netus AI for AI-Detection Evasion,"Recommends using Netus AI to avoid or bypass AI-generated text detectors, repeatedly advising to ""just use Netus AI"" for evading detection.",31,0.017
270,AI Ceilings vs Self-Improving Narrow AI,"Debate on AI ceilings with current tech versus prospects of self-improving, narrow AIs driving an intelligence explosion; skepticism about hype, human comprehension limits, and AI safety concerns.",31,0.017
271,DE to MLE Transition Expectations,"Questions about moving from Data Engineer to Machine Learning Engineer: responsibilities, remote/WLB, compensation targets, educational paths (certs vs OMSCS), and what to expect in MLE interviews.",30,0.017
272,"Bias, DEI, and Pay Equity in Tech","Debates about sexism and racism in tech: harassment and bias against women, DEI backlash, AI bias, and disputes over pay equity, salary transparency, and compensation practices.",30,0.017
273,Using Blackbox AI for Summaries and Math,"Users share experiences using Blackbox AI for text summarization and math help, praising its capabilities and comparing it with other AI tools like Cohesive.",30,0.017
274,University inaction on AI cheating,"Faculty lament university 'zero-tolerance' rhetoric but weak enforcement of AI cheating; burdensome proof requirements, fear of lawsuits/retention; students deny consequences; instructors shift to rubric-based grading emphasizing critical thinking.",29,0.016
275,AI in K-12 teaching,"Teachers discuss district-promoted AI tools for grading and lesson planning, benefits in saving time, concerns over quality, ethics, originality, and job impact, alongside burnout and professional development pressures.",29,0.016
276,Online Teaching Burnout and AI Cheating,"Teachers forced into online instruction describe widespread AI-enabled cheating, disengaged students, grade inflation, and burnout, leading to lowered standards and reluctance to report misconduct.",29,0.016
277,Computer Vision Career Strategies,"Advice on pursuing computer vision roles: value of projects and research, masters vs online certificates, PhD expectations, networking with faculty, building demos, internships, open-source, and broadening job search.",29,0.016
278,"AI, Indians, and harmful labor stereotypes","Mentions Indians and AI with affordability themes, containing harmful stereotypes and insinuations of exploitative labor, comparing Indians to Americans.",29,0.016
279,ChatGPT reliability and fact-checking,"Debate on ChatGPT’s trustworthiness: critics note inaccuracies and fabricated sources; supporters use it for leads and perspectives, emphasizing verification, caution, and not treating it as an authoritative source.",28,0.016
280,Autonomous and Flying Cars,"Debate compares AI to self-driving progress: complex, regulated, and years from ubiquity. Corner cases stall full autonomy; acceptance lags. Flying cars hinge on autonomy breakthroughs, offering near-term research opportunities.",28,0.016
281,AI in Homeschooling Debate,"Homeschool parents debate using AI: offers efficiency and tutoring but risks cheating, shallow learning, distraction, and premature tool reliance; emphasis on hands-on parental guidance and individualized curriculum choices.",28,0.016
282,LinkedIn AI Hawk: Automated Job Applications,"AI bot 'LinkedIn AI Hawk' auto-applies to jobs by analyzing profiles and postings, generating tailored CVs/cover letters and recruiter replies, enabling high-volume, customized applications to bypass screening systems.",28,0.016
283,AI Detectors Falsely Flag Autistic Writing,"Concerns that AI-detection tools misidentify autistic/neurodivergent students’ formulaic writing as AI-generated, causing false accusations in academia and calls to stop penalizing or forcing them to change writing styles.",28,0.016
284,Humanities Comeback and STEM Integration,"Debate over STEM dominance and humanities rigor, with evidence of a humanity-centered resurgence through interdisciplinary programs, ethics in tech/climate, increased funding, yet hampered by incomplete data and fragmented identities.",28,0.016
285,AI-Generated Writing and Academic Integrity,"Educators confronting suspected AI-written reports and papers, setting ethics policies, detecting misuse, handling disputes, and deciding grading or sanctions amid limited proof and institutional constraints.",28,0.016
286,CS Degrees vs Self-Taught/Bootcamp Paths,"Debate over necessity of four-year CS degrees versus self-taught/bootcamp paths; web dev commoditization, importance of CS fundamentals, curriculum design, and AI’s impact on industry roles and adaptability.",27,0.015
287,AI’s Longstanding History and Misconceptions,"Argues AI isn’t new: it has existed for decades, from tic-tac-toe programs to Scantron assessments; 'virtual' terminology predates hype, and media fosters public misunderstanding.",27,0.015
288,AI Voice Notes & Transcription Apps,"AI tools using Whisper/GPT to transcribe audio to text, translate, summarize meetings, create action plans, and export edited notes to Notion or other apps.",27,0.015
289,r/learnprogramming AutoModerator code screenshot warning,"Automated Reddit message warning users not to post code screenshots, instructing proper code formatting, advising to edit posts and contact moderators if needed.",27,0.015
290,DecentralGPT decentralized AI with rewards,"Promotional content for DecentralGPT, a decentralized, uncensored AI hub offering GPT/Claude/DeepSeek access, privacy via distributed GPUs, and DGC token rewards for usage; anti-big-tech, join-the-rebellion messaging.",27,0.015
291,Developer Imposter Syndrome with Library Reliance,"Developers feeling imposter syndrome when relying on packages/libraries; questioning legitimacy of selling such apps; advice to learn underlying tools, fundamentals, and best practices to build confidence.",27,0.015
292,AI in IEP Development,"Debate among special educators about using AI to draft IEPs—concerns over legal/ethical integrity and individualized goals versus advocates citing efficiency, standardized language, confidentiality-safe use, and integrated databases to reduce workload.",26,0.015
293,Interactive Webinar Platforms for Lead Generation,"Reviews and comparisons of webinar software for educational marketing, emphasizing interactivity (Q&A, polls, screen sharing), AI automation, analytics, and CRM integrations to drive attendee engagement and nurture leads.",26,0.015
294,Math in CS Education and Careers,"Students debate adding math majors/minors to CS, asking which CS fields are math-heavy, what math is useful (e.g., ML), and whether high-paying CS jobs require heavy math.",26,0.015
295,Practical GenAI use in R coding,"AI helps troubleshoot and style code/graphs; overreliance risks errors. Building R templates and reference docs, and heeding journal policies, offer more reliable, time-saving workflows.",26,0.015
296,Enterprise LLM/Copilot Adoption & Risks,"Organizations explore LLMs/copilots for coding, support, and document search via APIs; prefer private/custom models. Debate persists over productivity gains versus code quality, technical debt, and security/privacy risks.",26,0.015
297,AI-assisted academic research: speed vs rigor,"Debate on AI-powered literature review and drafting: rapid paper summarization and citation versus lack of understanding, privacy risks, idea plagiarism, and the need for human verification and scholarly judgment.",26,0.015
298,Python/R vs SPSS/SAS for Statistical Analysis,"Advice on selecting tools for data analysis—favoring Python or R over SPSS/SAS/Stata—plus learning resources (Jupyter/Colab, Kaggle), visualization tips, and essential statistics skills; brief note on workflow automation.",26,0.015
299,Art/Design Careers and Skills Debate,"Posts from artists/design students debating craft vs digital tools, AI and outsourcing impacts, and seeking viable career paths in animation, graphic design, UX, and 3D modeling amid education/skill anxieties.",26,0.015
300,Web Dev vs Data Science/ML Choice,"Students confused about choosing web development versus data science/machine learning, asking about job prospects, saturation, skills and roadmaps, fearing FOMO and switching costs, seeking early-career guidance.",26,0.015
