Topic,Topic summary,Topic description,Count,% of corpus
301,New grad ML job search and flexibility,"Early-career CS grads exploring entry-level machine learning or software engineering roles, internships, certifications, and strategies for landing flexible or remote positions despite limited experience and health constraints.",26,0.015
302,Anti-Cheating Assessment Strategies,"Instructors discuss in-class handwritten assessments using blue books, multiple test versions, scantron tradeoffs, and managing accommodations to deter cheating while improving student writing, critical thinking, and exam logistics.",25,0.014
303,"AI in LMS: Admin Help, Human Grading","Educators discuss integrating AI (Canvas, SparkSpace) for tedious tasks, due dates, accommodations, and rubric-guided feedback, while rejecting AI-generated grades and insisting on human oversight in assessment.",25,0.014
304,Internship Challenges: Referrals & Unpaid Roles,"Students struggle to secure internships, use referrals to bypass interviews, and face unpaid, data-entry tasks; they seek paid or remote opportunities and advice on fair compensation at small companies.",25,0.014
305,"Learning to Code: Projects, Mental Models, and Motivation","Advocates project-driven, deliberate practice to build mental models; start at right level, embrace debugging struggles, use tools like ChatGPT; seek motivation/accountability over toxic forums.",25,0.014
306,Econometrics-Focused Economics Path to Data Science,"Advice on pursuing an economics/econometrics-heavy curriculum with math and CS to prepare for data analysis roles; emphasizes causal inference, programming skills, and key courses (micro/macro, labor, ML).",25,0.014
307,OpenAI elite hiring vs IBM/Watson backlash,"Discussion contrasting OpenAI’s top-tier SWE pipeline with widespread criticism of IBM Watson and IBM Cloud as overhyped, unreliable, and lagging competitors in AI and cloud.",25,0.014
308,iOS App Dev Learning & Career Outlook,"Beginners discuss learning iOS and app development, market saturation, whether to pursue formal education, self-teaching paths, and gather community experiences on coding as hobby vs job and career outlook.",25,0.014
309,LLM Mechanics and Seeding,"Explains LLMs like ChatGPT: token-based input-output systems with stochastic behavior via seeds, not true knowledge. Highlights future use as natural-language interfaces for data querying over traditional SQL.",25,0.014
310,"AI for Grammar, Not Writing Quality","Writers accept built-in spellcheck/grammar aids but avoid AI for prose or structural edits, citing nuance loss and mistakes; prefer peer review and practice to develop voice and improve writing.",25,0.014
311,Fatigue over AI posts in r/Professors,"Users say AI discussions dominate; urge confining AI posts to weekend/designated threads; note repetition, suspected brigading/bots, and pro‑AI outsiders; want more variety and higher-quality discourse.",25,0.014
