Topic,Topic summary,Topic description,Count,% of corpus
101,AI Cheating in Coding Interviews,"Concerns and practices around detecting AI-assisted cheating in coding interviews: in-person proctoring debates, red flags, screen-sharing checks, trick questions, and rejecting candidates perceived as AI-reliant.",105,0.059
102,GRE to Offset Low GPA in Grad Admissions,"Applicants discuss leveraging strong GRE scores, research, and experience to counter low GPAs when applying to MS/PhD programs, considering US vs European requirements and post-bacc options.",104,0.058
103,Toxic Managers and Career Strain,"Employees describe toxic managers, blocked promotions, misaligned roles, and dysfunctional teams, leading to burnout, mental health strain, and difficult job searches or team transfers in the tech industry.",104,0.058
104,AI detection in college admissions essays,"Critiques use of AI detectors by admissions officers, citing high false positives/negatives, difficulty detecting edited AI, potential bias and applicant pool harm, and proposing phasing out essays.",103,0.058
105,AI-Assisted Grading of Assignments,"Using AI tools to automatically grade student essays and papers, streamlining grading and reducing instructor workload.",102,0.057
106,Data Science Training & Careers,"Guides and opinions on data science education: comparing university programs and PG courses, required skills and degrees, and career paths into analytics, consulting, hedge funds, and data scientist roles.",102,0.057
107,Cursor AI Code Editor Discussion,"Experiences and critiques of Cursor, an AI-powered VS Code-like IDE: quick app building, interview expectations, transparency and billing issues, limited model control/API keys, bugs, and comparisons with VS Code/Vim/alternatives.",101,0.057
108,AI Cheating in Asynchronous Online Courses,"Instructors debate viability of asynchronous online classes amid widespread AI-assisted cheating, limited proctoring, and shifts toward in-person exams and alternative assessments to protect academic integrity.",101,0.057
109,OpenAI benchmarks and profitability,"Debates over OpenAI’s benchmark integrity and competitive performance, alongside discussion of its business economics: billion-dollar revenue prospects, profitability constraints, and reducing expensive inference costs.",98,0.055
110,ChatGPT vs Calculators Reliability,"Users argue ChatGPT is unreliable for math and real-world decisions, contrasting it with calculators/Wolfram’s consistent, explainable methods; highlighting hallucinations, poor reasoning, unsafe advice, and lacking verifiable proofs or sources.",98,0.055
111,AI in Teacher Lesson Planning,"Teachers discuss creating, reusing, and adapting lesson plans, administrative requirements, and selective AI use—helpful for rote tasks but unreliable for pedagogy, safety, or classroom management.",97,0.055
112,Magic School AI,"Teachers discussing Magic School AI and similar school AI tools for rubric creation and lesson planning, district use, and comparisons with Diffit.",90,0.051
113,Backend vs Full-Stack Web Careers (Java),"Discussions on choosing backend over frontend/full‑stack web development, emphasizing Java microservices, language selection (Java, Python, C#), enterprise demand, learning paths, and career strategy for job readiness.",89,0.05
114,AR/VR Development Careers & Skills,"Roles, skills, and industry trends in AR/VR: graphics, computer vision/SLAM, tech stacks, key companies, hiring challenges, and career paths, with AR growth and VR niche status.",88,0.049
115,Fear of Being Replaced by AI,"Statements expressing concern or prediction that AI will replace people, emphasizing imminent or inevitable displacement and replaceability by artificial intelligence.",88,0.049
116,"Career Pivots for Fulfilling, Remote-Friendly Work","Professionals weighing offers and paths to avoid pigeonholing, grow transferable skills, and find meaningful, flexible (often remote) roles—considering startups, content, data/tech, and generalist tracks toward leadership, VC, or founding.",88,0.049
117,Econ vs Stats vs Data Science Degrees,"Evaluating econ vs math/stats vs data science degrees for data/ML careers, weighing math depth, programming focus, online options, and implications for master's/PhD eligibility and career outcomes.",88,0.049
118,"Skepticism of AI ""vibe coding""","Debate condemning vibe coding—AI-generated code without understanding—as irresponsible, unmaintainable, and unlikely to ship; degrades codebases and learning, creating downstream work fixing AI-induced problems.",87,0.049
119,Prompt Engineering Skills and Roles,"Discussion of prompt engineering: techniques for crafting prompts to steer LLMs, required skills, day-to-day role of prompt engineers, and debates over the term’s legitimacy/pejorative use.",87,0.049
120,Software Job Offer Compensation Breakdown,"Reports detailing software roles with education and prior experience, locations, salaries, relocation and signing bonuses, recurring bonuses/equity, and total compensation across companies and industries.",86,0.048
121,"Homeschooling experiences, socialization, and extracurriculars","Parents discuss homeschooling methods, curricula, schedules, rich extracurriculars and travel, socialization concerns, sports access, testing and college readiness, contrasting experiences with public/private school.",86,0.048
122,ChatGPT Free vs Paid Monetization,"Users discuss ChatGPT’s free versus paid tiers, anticipated monetization through ads/paywalls, quality differences favoring paid plans, and concerns about inevitable “enshittification” and fees impacting writers.",85,0.048
123,Blockchain Careers and Learning Debate,"Discussions weigh blockchain’s hype versus value, questioning AI-blockchain job viability, practical applications beyond crypto, and whether students should invest time learning blockchain amid polarized community opinions and tutorials.",84,0.047
124,Family Debate: AI Tools vs Coding Fundamentals,"A sibling disputes their father’s advice to rely on AI for building games and websites, advocating foundational programming education over 'vibe coding' and stressing long-term skills beyond creativity.",84,0.047
125,Authentic Reading and Discussion Strategies for Online Classes,"Educators share methods to ensure reading and engagement: low/high-stakes quizzes, annotated readings, discussion boards with peer replies, in-class checks, presentations, and Canvas-embedded activities to reduce AI misuse and improve participation.",83,0.047
126,Jose Portilla Udemy Data Science Courses and Alternatives,"Evaluating Jose Portilla’s Udemy Python for Data Science course versus other bootcamps and platforms (DataCamp, DataQuest), focusing on pricing, content overlap (probability, statistics), and overall value.",81,0.046
127,Canadian Tech Hubs & Salaries,"Discussion of Canada’s tech scene: Toronto leading hub (fintech, major offices), Montreal strong in AI/gaming with lower salaries, Vancouver niches; comparisons of salaries, taxes, and job opportunities.",81,0.046
128,Assessment & Grading Strategies in STEM Courses,"Courses emphasize homework as practice, randomized quizzes, and proctored final exams; harder, concept-focused tests with low grade boundaries and manual grading deter AI cheating and better reflect student understanding.",79,0.044
129,Undetectable AI to Humanize ChatGPT and Bypass Detectors,"Advocating tools that humanize ChatGPT output to avoid plagiarism and evade AI detection systems, promoting bypass techniques for being detected as AI-generated text.",78,0.044
130,Future of Higher Education in the AI Era,"Debate over AI’s disruption of universities—questioning credential-focused models while defending residential, human-centered learning that builds critical thinking, empathy, and dialogue; calls for reform amid information abundance.",78,0.044
131,Limits of AI Text Detectors,"Discussion of how AI text detectors work using statistical probabilities, their unreliability and false positives, especially with mixed human/AI writing and memorized high-probability texts; longer texts yield better detection.",77,0.043
132,Online exam proctoring,"Debate on lockdown browsers and proctoring tools (Respondus, Honorlock): AI webcam/screen monitoring, privacy concerns, false positives, costs, scalability gaps, and widespread circumvention via VMs, multiple devices; testing-center alternatives proposed.",77,0.043
133,LLM-First Implementation,"Advocating LLM-based handling of tasks and queries, integrating ask LLM and search bar features, and clarifying required capabilities and constraints.",75,0.042
134,AI progress: exponential growth vs limits,"Debate between optimism about accelerating AI capabilities and skepticism citing Moore’s Law slowdown, finite resources, data limits, logistic growth, and hype cycles constraining long-term exponential improvement.",75,0.042
135,LLMs vs AI: Capabilities and Limits,"Debate over labeling LLMs as AI, stressing statistical nature and limited reasoning; covers training for uncertainty/abstention, responsible academic use, accountability, and misconceptions about general intelligence.",73,0.041
136,AI-Generated Cover Letters,"Debate on using AI to draft tailored cover letters: advocates use prompt engineering and keyword optimization; critics warn AI-sounding letters get rejected, especially in academia; workflows include VA-run prompts.",73,0.041
137,Choosing Mechatronics vs Electrical Engineering for Robotics/AI,"Comparing mechatronics and EE/CE for robotics/AI careers, balancing interdisciplinary breadth vs specialized depth, controls/electronics emphasis, AI relevance, job market resilience, and ease of switching programs.",73,0.041
138,AI overuse in education; emphasis on people skills,"Students and educators lament AI-driven tasks and pressure to use AI; some counter by designing people-first assessments (oral defenses, rubrics) that reward human understanding over AI reliance.",73,0.041
139,Cloud Platform Certifications (GCP/AWS/Azure),"Advice on selecting cloud platform and earning certifications—particularly GCP—with certification levels and roles, exam prep resources and free tiers, costs, hands-on labs, and career advantages.",73,0.041
140,ChatGPT/Copilot and self-improving SQLi worm concept,"Discussion of ChatGPT/GitHub Copilot alongside a conceptual design for a self-propagating 'defensive' worm using SQL injection, multi-vector spread, C2 reporting, update mechanisms, and ethical/legal cautions.",72,0.04
141,Turnitin AI Detection Usage and Accuracy,"Users rely on Turnitin’s AI detection in education, viewing it as accurate and widely adopted, noting detectors lag AI progress, with automatic departmental checks reinforcing trust.",71,0.04
142,"OpenAI tools, API, and company chatter","Discussion of OpenAI’s API and tools (e.g., Gym), using OpenAI to complete tasks, employment at OpenAI, and comparisons to Nvidia/GPUs; asking if OpenAI already did this.",71,0.04
143,Tech job search struggles and rejections,"CS/IT candidates apply widely, network, and interview but receive few callbacks and repeated rejections; they question causes and seek practical advice to improve resumes, interviews, and outcomes.",71,0.04
144,AI Tools and Examples,"Guides and examples of AI tools and apps, including free options, AI detection tools, and training capabilities, with instructions on how to use them.",70,0.039
145,"Education Debates: School Hours, Teachers, and Child Labor","Debates on compulsory school hours, teacher effectiveness, child labor laws, student mental health, and the value of broad education versus AI/internet, stressing citizenship, options, and responsibility in the U.S.",70,0.039
146,Self-Taught Path to Developer Jobs,"Personal stories and advice on transitioning to web/software development: CS50, building projects, focused learning, certifications (AWS, CompTIA), networking, interview prep, and persistence to land junior roles.",69,0.039
147,AI and Copyright Law Debate,"Discussions on legal status of AI-generated content, authors’ rights, fair use, and evolving copyright law, including ownership, licensing, and court interpretations amid uncertain intellectual property standards.",69,0.039
148,AI CEOs Debate,"Debate over replacing corporate executives with AI making data-driven decisions, envisioning AI-to-AI meetings, while skeptics cite hype-driven choices and investor/shareholder resistance as key barriers.",68,0.038
149,Getting Started with Machine Learning in Python,"Newcomers seeking guidance and resources to learn machine learning/deep learning in Python, including basics like NumPy, pandas, scikit-learn, matplotlib, virtual environments, and step-by-step beginner-friendly tutorials.",67,0.038
150,SpambotDetector summon message,Automated message for a neural-network spam detector; summon with 'isbot <username>'; links to r/SpambotDetector/GitHub; states specific users aren't bots and offers opt-out.,67,0.038
151,AI vs Human Intelligence and Consciousness,"Debate over definitions of intelligence and consciousness, comparing biological brains' adaptability and efficiency to AI's limitations and potential sentience; critiques of hype, fallacies, and intelligence's predictive value.",67,0.038
152,"ChatGPT/Davinci: Fine-Tuning, Compute, and Utility","Explains ChatGPT/InstructGPT (Davinci) foundations, RLHF, fine-tuning and transfer learning approaches, required GPU/IO constraints, and debates over ChatGPT’s usefulness, misconceptions, and skepticism.",66,0.037
153,Learning ML: Math & Courses,"Guides to learning machine learning focusing on prerequisites—linear algebra, calculus, probability—and recommended courses like Andrew Ng/Coursera, fast.ai, MIT OCW, plus practice via Kaggle and projects.",66,0.037
154,Practical ML/AI in Industry and Education,"Discussion on ML/AI’s real-world usefulness across products, not a bubble; approximation benefits; future integration into CS curricula; need balanced skills and infrastructure beyond pure ML research.",65,0.037
155,Teaching Critical Thinking in the AI Era,"Prioritize core critical thinking—question formulation and evaluation of AI outputs—over prompt tutorials, warning that AI reliance may weaken human thinking and disrupt educational goals and knowledge-work roles.",64,0.036
156,Quant/HFT Careers and Transitions,"Career advice and Q&A on breaking into quant/HFT firms (Jane Street, HRT): roles (quant dev/SWE/QR), required skills, interview prep, compensation, culture, hiring timelines, and transitions from FAANG or PhD backgrounds.",64,0.036
157,"Sarcastic ""AI would say"" callouts","Sarcastic remarks claiming statements sound like an AI would say, mocking AI-like phrasing and tone; meta-discussion calling out AI-generated or robotic responses, often with casual slang.",63,0.035
158,Thesis Topic & Supervisor Challenges,"Students struggling to choose thesis topics and advisors, facing data access issues and unresponsive supervisors, exploring feasible approaches using public datasets or surveys to complete digital business/IT theses.",63,0.035
159,Ethical Use of AI,"Discussion on AI ethics—what constitutes ethical vs unethical use, support for embracing AI responsibly, and considerations for using AI to communicate diplomatically while focusing on responsible application.",63,0.035
160,Machine Learning & Data Science,"Techniques, tools, and applications of machine learning in data science and analytics, including algorithms, model training, and AI-driven insights.",62,0.035
161,Turnitin circumvention services,"Promoting unofficial Turnitin access offering similarity and AI-detection reports, claiming no repository submission, to help users avoid plagiarism flags; contact via DM/instructor accounts.",61,0.034
162,AI Use Policies in Higher-Ed Syllabi,"Instructors debate and design AI-use syllabus policies, struggle with student compliance and unreliable detection, consider bans or assignment redesigns, and seek clearer institutional guidance across disciplines.",61,0.034
163,"Data Analyst Skills: Excel, SQL, BI","Recommendations for entry-level data analytics: master Excel, SQL, and visualization (Tableau/Power BI); add Python/MySQL for applied analytics. Emphasis on practical reporting, basic statistics, and demonstrable skills over certificates.",60,0.034
164,Breaking into Data Science Careers,"Questions about pursuing data science careers: switching from other fields, focusing on DS internships vs SDE roles, required skills (Python/SQL/ML), and strategies for job applications and entry-level opportunities.",60,0.034
165,Automated Stock Trading Bots,"Discussion of designing and deploying stock trading bots—data ingestion via APIs, hosting, strategies and backtesting—plus realism about difficulty of profitability against sophisticated quantitative firms.",60,0.034
166,Machine Learning Education & Resources,"Users discuss learning ML for projects and classes, critique poor instructional content, seek clearer math and implementation explanations, express interest and optimism, and share thanks and encouragement.",59,0.033
167,US-China STEM Education and National Security,"Debate over Chinese students in U.S. STEM: stay rates, visa and pay dynamics, university dependence, risks of espionage/dual-use tech transfer, and congressional scrutiny seeking tighter oversight and restrictions.",59,0.033
168,Enduring Cybersecurity Demand,"Cybersecurity remains essential amid constantly evolving attacks. Human expertise and continuous updates outpace full automation; AI and deep learning aid defenses, ensuring persistent demand for security engineers across technologies.",58,0.033
169,CS vs Software Engineering,"Differences and overlap between Computer Science and Software Engineering: theory vs application, program structures and accreditation (P.Eng), course flexibility, hardware focus in CE, similar job outcomes and co-op opportunities.",57,0.032
170,Startups vs Big Tech Careers,"Firsthand comparisons of startups and larger companies: risk vs security, culture and hiring rigor, compensation and promotion tactics, modern stacks, Big N influence, AI/fintech hype, work-life balance.",57,0.032
171,Harvard edX CS Courses,"Guides to building CS foundations via free or low-cost MOOCs—especially Harvard CS on edX—covering programming, algorithms, systems, math, certificates, and practice resources with bootcamp-style alternatives.",56,0.031
172,Learning and Teaching TensorFlow,"Experiences and strategies for learning and teaching TensorFlow, curating resources, handling bugs, preparing presentations and notebooks; plus guidance on building and sharing your own machine learning library.",56,0.031
173,Quantum Computing and AI Careers,"Discussions about quantum computing’s infancy, hype, algorithms, and its intersection with AI/ML; questions about research paths, degrees, and feasibility of specializing without a physics background.",55,0.031
174,"AI, Wix, and Web Dev Automation","Discussion on AI's effect on web development: builders like Wix/WordPress replace simple sites; AI better at boilerplate, weak at complex UI/UX; debate whether backend or frontend automates first.",55,0.031
175,AI Auto-Grading for Math,"Seeking advice on building an AI math auto-grader that delivers detailed feedback, aligns with rubrics, validated by TAs/professors, and integrates with Canvas/Gradescope without increasing workload.",55,0.031
176,Undergraduate research outreach and assistantships,"Students seek research roles by emailing professors for advising/assistantships, presenting AP research portfolios and resumes, and exploring early topics (e.g., EEG + machine learning) to build experience.",55,0.031
177,Glean and Lecture Recording Accommodations,"Debate among faculty, students, and Glean about recording lectures for disability accommodations, data ownership/AI training concerns, transcription and note-taking effectiveness, and evidence of learning benefits.",54,0.03
178,"AI, Cheating, and Pedagogy","Educators debate AI's impact on student cheating: rising perceived impunity, anxiety-driven AI use, detection and policy challenges, moral responsibility, and pedagogical shifts toward assessment redesign and in-class handwritten exams.",53,0.03
179,Ask AI for Help,"Encouragement to ask AI for answers or assistance, deferring questions and tasks to AI for advice, solutions, or fun.",52,0.029
180,ML/AI Product Engineering & Distributed Systems,"Discussions on preparing for ML engineering roles focused on LLM-driven product development, data pipelines, vector databases, and distributed system design; practical skills over deep math, interviews, and career strategy.",52,0.029
181,ChatGPT and Coding: Productivity vs Jobs,"Debate over ChatGPT/GPT as coding assistant: boosts productivity, debugging, learning; concerns about job displacement; skepticism that code generation solves architectural complexity or team/process bottlenecks.",51,0.029
182,AI Automation in Accounting,"AI is streamlining routine accounting (bookkeeping, invoices, document extraction), reducing entry-level roles and some outsourcing, while high-skill work remains; outcomes depend on implementation quality, trust, speed, and cost.",51,0.029
183,Embedded and Software Career Transitions,"Advice and experiences on pivoting within tech—from embedded C/Ada to modern systems or product roles—leveraging prior experience, choosing study paths/certifications, and balancing autonomy, impact, and market competitiveness.",51,0.029
184,Python vs R for Data Science and Visualization,"Comparisons of Python, R, and MATLAB for data analysis and visualization: Python’s versatility vs R’s statistical packages and ggplot/tidyverse; common academic usage; exporting figures and finishing in design tools.",50,0.028
185,AI and Cybersecurity Careers,"Students explore career choices in cybersecurity vs AI, asking about combining fields via ML for threat detection, long-term prospects, required degrees, and roles like ethical hacking and government work.",50,0.028
186,Full-stack JS + Spring Boot/Hibernate debugging,"Troubleshooting EmailJS booking form, React TypeScript Axios/state errors, and Spring Boot Postgres connectivity via Hibernate/HikariCP; logs feature jar/org/hibernate entries and chunked JS bundles.",50,0.028
187,MATLAB vs Python for Scientific Computing,"Comparisons of MATLAB and Python: licensing costs, toolboxes and Simulink, performance in matrix vs complex tasks, industry adoption; guidance to choose language based on project needs.",49,0.028
188,Debating LLMs in Education,"Debate over student and academic use of LLMs: skepticism about classroom utility, readability, and rampant misuse versus 'glasses' democratization framing emphasizing critical thinking, policy responses, and evolving professional collaboration.",49,0.028
189,Workplace AI misuse and guilt,"Employee flags ChatGPT errors to clients; coworkers exposed for overreliance giving wrong info; management adds training/ethics; OP feels guilty, commenters say they saved clients/company and need not apologize.",48,0.027
190,Guilt in Lord of the Flies,"Analysis of guilt in Lord of the Flies, focusing on Ralph, Jack, and the boys’ culpability in the sow hunt, the abandoned signal fire, and Piggy’s and Simon’s deaths.",48,0.027
191,Elon Musk Mars and Self-Driving Controversies,"Heated debate over Musk’s credibility, timelines for Mars colonization, Tesla Full Self-Driving vs Waymo, AI expertise, Lex Fridman interviews, and allegations of exaggeration, grift, and academic record disputes.",48,0.027
192,AI Detectors Misclassify Founding Documents,"Debates about AI text detectors erroneously labeling the U.S. Constitution and Declaration of Independence as AI-generated, underscoring high false positives and reliability concerns.",48,0.027
193,Perusall Teaching & AI,"Educators discuss using Perusall/Hypothesis for social annotation in asynchronous courses, fostering reading engagement via prompts/quizzes, limited platform AI-detection, concerns about tracking copy-paste, and sharing best-practice strategies and RSI considerations.",48,0.027
194,"Learning Python: Courses, Projects, and Resources","Guides, courses, and resources for learning Python and programming basics, including exercises, projects, debugging/testing practices, data structures/algorithms, and advice on progressing beyond basics.",47,0.026
195,Tenure-track faculty burnout and career pivots,"Tenure-track professors lament low pay, heavy teaching and student pressures; explore reducing teaching, moving to departmental administration or staff roles in higher ed, or seeking better-paid alternatives.",47,0.026
196,AI and Data Science Podcasts (Lex Fridman),"Recommendations and praise for AI, data science, and academia podcasts—especially Lex Fridman’s AI show—plus Software Engineering Daily and other science programs featuring expert guests.",47,0.026
197,AI-Resistant Assignment Design,"Calls to redesign assignments for the AI era: in-class supervised work, best practices for AI resistance, and ethical tensions around AI grading versus student AI use.",46,0.026
198,Machine learning for media,"Applying machine learning and data mining to categorize movies and recommend content, and to model or generate music from MIDI notes; includes frameworks, architecture, and techniques like Markov chains.",46,0.026
199,Job shadowing for career discovery,"Advice to explore careers by shadowing multiple roles, learning about preferred positions, then applying; find shadowing opportunities using Shadowing AI or similar platforms.",46,0.026
200,AI Smart Glasses in Exams,"Discussion of Meta/Ray-Ban smart glasses in exam settings: cheating potential, limitations (no display, voice commands), detection cues, disability accommodations, enforcement challenges and practicality.",46,0.026
