Topic,Topic summary,Topic description,Count,% of corpus
-1,Student-Centered Education and CS Learning,"Discussions on effective, student-centered education: project-based and competency-based pedagogy, AI-supported knowledge management, alternatives to testing, self-directed CS learning paths, and advice for distinctive, reflective college essays.",129038,72.566
0,AI Replacing Software Developers,"Debate on AI as a tool vs replacement for programmers; effects on productivity, workflows, and potential commoditization of software and industry shift if AI fully automates coding.",4862,2.734
1,Choosing Your First Programming Language,"Guidance on choosing a first programming language, comparing Python, Java, JavaScript, and C/C++, with use cases (web, ML/AI, systems, games) and recommended learning paths for beginners.",2438,1.371
2,Extensible Tic Tac Toe with AI,"Design a customizable tic-tac-toe platform: variable boards and win rules, player symbols, AI (minimax/ML) difficulties, UI/web, persistence with Elo, networking, and unit-tested, modular architecture.",1823,1.025
3,ChatGPT Classroom Instruction and Ethics,"Lesson plans and discussions on integrating ChatGPT into student learning and assignments, guiding use, evaluation of responses, critical thinking, and ethical considerations in classroom and homeschool settings.",1555,0.874
4,Detecting AI-Generated Posts,"Users question whether content is AI-written, discuss signs of AI-generated posts on Reddit, and seek methods to determine if posts were produced by AI.",1096,0.616
5,Using ChatGPT,"Mentions of ChatGPT, guidance to use or ask ChatGPT to write or summarize content; references to ChatGPT identity and usage instructions.",1062,0.597
6,AI vs Human Teachers,"Discussion on AI's role in education, potential to replace or supplement teachers, offering personalized, unbiased, multilingual instruction and consistency, with concerns about empathy, complexity, hands-on labs, oversight, and jobs.",769,0.432
7,"ChatGPT for Coding: Pros, Cons, and Tips","Using ChatGPT for coding: effective for refactoring, explanations, small functions and debugging; unreliable for complex logic. Break tasks down, verify outputs, credit sources, and heed legal/IP risks.",753,0.423
8,Academic Email Practices: AI Use and Admissions Spam,"Experiences with AI-generated student emails—etiquette, integrity, and effectiveness—plus an analysis of colleges’ mass email marketing, spam frequency, and subject-line gimmicks in admissions outreach.",706,0.397
9,LLM-Assisted Coding Debate,"Discussion on using LLMs to generate syntax/boilerplate and integrate with tests/QA, contrasted with concerns about code quality, learning erosion, and advice to understand outputs and avoid overreliance.",610,0.343
10,Math for Programmers: Discrete and Linear Algebra,"Which math best supports programming and CS—emphasizing discrete math and linear algebra; calculus, statistics, and geometry applied in graphics, ML, optimization, and physics/engineering contexts.",561,0.315
11,"Student disengagement, cheating, and administrative conflict","Educators lament disengaged students, widespread cheating (AI/Chegg), and unsupportive administration, with post-COVID skill decline, policy enforcement tensions, and attempts to maintain boundaries amid complaints.",557,0.313
12,Computational Linguistics and NLP Careers,"Distinguishes computational linguistics from NLP, outlines CS-to-grad pathways, emphasizes ML/math foundations, and notes limited non-NLP industry opportunities and academic job market challenges.",546,0.307
13,Peer Review Integrity and Reform,"Allegations of AI-written peer reviews spur calls for open, accountable reviewing, objective standards, editorial oversight, independent audits, and reporting misuse to safeguard research integrity.",538,0.303
14,Coding Bootcamps vs CS Degrees vs Self-Taught,"Comparing paths into software/web development: coding bootcamps, CS degrees, and self-teaching—trade-offs in cost, time, structure, networking, and job outcomes; experience and fit determine success.",477,0.268
15,AI Capabilities and Usage,"Discussion assessing whether and when to use AI, what AI can do, and distinguishing AI-driven tasks from non-AI approaches.",467,0.263
16,Resume Bullet-Point Optimization,"Guidance on optimizing resumes: prioritize concise, one-line accomplishment bullets, remove redundancies, restructure sections and projects, improve grammar and formatting, list relevant skills only, and emphasize impact over duties.",456,0.256
17,Macroeconomic Drivers of Tech Layoffs,"Tech layoffs stem mainly from high interest rates, profitability pressures, tax changes, consolidation, and improved offshoring; AI is secondary but pushes higher RPE expectations and workforce adjustments.",446,0.251
18,AI Tools for Academic Research,"Platforms leveraging AI to search, summarize, analyze, and manage research papers and PDFs; support literature reviews, citations, writing assistance, and knowledge organization for scholars and researchers.",435,0.245
19,Grammarly vs GrammarlyGO and AI detection in academia,"Discussion about Grammarly’s grammar checker vs GrammarlyGO generative AI, subscriptions, and whether using Grammarly triggers academic AI-detection false positives in college integrity processes.",433,0.244
20,Introduction to Computer Vision,"Getting started with computer vision: working with images, cameras, pixels, color, and recognition using tools like OpenCV.",426,0.24
21,AI Detection Tools & Effectiveness,"Mentions AI content detectors/checkers, questioning their effectiveness ('don’t work') while also referencing resources listing top AI detection tools.",425,0.239
22,Conferences vs. Journals in Computer Science/AI,"Computer science/AI prioritize rapid, conference-based publication and arXiv preprints; journals extend work. Subfield norms, heavy reviewing, open access, and warnings about predatory publishing shape practices.",421,0.237
23,Fake Citations and Academic Integrity,"Discussion of fabricated or non-existent citations—often AI-invented—as academic dishonesty, the duty to verify references, and distinguishing intentional fabrication from careless citation errors in student work.",421,0.237
24,Andrew Ng’s Machine Learning Course (Coursera),Mentions and praise of Andrew Ng’s foundational machine learning course offered on Coursera; users highlight its quality and impact.,413,0.232
25,Tech Job Offer Negotiation and Tradeoffs,"Evaluating and negotiating tech job offers, comparing compensation (salary, bonus, RSUs), roles, company stage (startup vs large), equity prospects, work-life balance, mentorship, and long-term career goals.",407,0.229
26,Natural Language Processing (NLP),"Computational methods to process and understand human language text—tokenizing words, parsing sentences, and deriving meaning for tasks like analysis, classification, and generation.",397,0.223
27,Student Study and Flashcard Apps,"Recommends tools for students, highlighting flashcard-based learning (Anki-like, Traverse), notes, quizzes, and free apps to organize studying, tasks, and schedules.",390,0.219
28,"Developer laptops: Mac vs Windows, GPU/CUDA","Comparisons of MacBook and Windows laptops for coding, iOS and ML work, hardware recommendations, and troubleshooting CUDA/GPU memory issues on Linux/WSL during model fine-tuning.",385,0.217
29,LLM use and plagiarism in academic writing,"Debate over acceptable LLM assistance: editing versus generation, disclosure requirements, plagiarism concerns, detection heuristics, and faculty reactions/policies across disciplines regarding student papers and application materials.",384,0.216
30,CS/ML PhD Career Paths,"US CS/ML PhD structure, research expectations, academic job scarcity, and career decisions—paths to tenure-track vs industry research scientist roles (FAANG/AI labs), competitiveness, internships, publishing, and strategies for transition.",374,0.21
31,Graduate Academic Integrity Allegation,"Graduate student challenges plagiarism and deadline-tampering accusations after incomplete-related access problems; TA reports to academic integrity board. Student seeks dean’s help, citing policy, grading errors, and solo project constraints.",359,0.202
32,College Admissions Chance-Me (STEM),"High schoolers outline GPA, AP/SAT, clubs, research, and awards, plus demographics and goals, requesting advice on college lists, chances, and admissions strategy for competitive STEM programs.",356,0.2
33,AI as the New Calculator,"Educators liken AI to calculators, urging foundational learning and critical thinking first, then teaching appropriate, efficient tool use and timing in classrooms.",338,0.19
34,Mandating Google Docs Version History,"Instructors mandate Google Docs version history/edit tracking to verify writing process, detect AI-generated work, and document group contributions; students must provide histories on request or face penalties.",334,0.188
35,AI Bubble and Dot-Com Parallels,"AI seen as an overhyped, investor-driven bubble like dot-com: huge funding and costs, shaky productivity and profits, impending burst, layoffs, and consolidation where only top models and few firms remain.",332,0.187
36,Choosing a CS/Data Science Program: UIUC vs Alternatives,"Students compare CS-related options—UIUC, Purdue, SCU, UW, UCs—considering direct admission vs transfers, cost/scholarships, prestige, research/internship access, campus culture, location, and effects on grad-school prospects.",329,0.185
37,Value of a CS Master’s vs Experience,"Evaluates the ROI of a CS master’s versus immediate work: beneficial for research/ML specializations, but experience, employer-funded study, and soft skills often outweigh immediate graduate study.",297,0.167
38,Turnitin AI Detection Reliability,"Discussion of Turnitin's AI detection: probabilistic scores, false positives, variable reliability versus plagiarism matching. Emphasizes instructor judgment, tool as adjunct, student disputes, and community checks or modifications affecting flags.",289,0.163
39,Data Engineering vs Data Science Roles,"Differentiating data engineer, data scientist, and ML engineer roles, responsibilities, ETL/pipelines, required skills, hiring trends, and career advice/resources for entering data engineering.",284,0.16
40,AI Art Ethics and Value Debate,"Critiques of AI-generated art: lack of artist consent for training data, perceived absence of human process/skill, devaluation of originality; many artists reject AI art as true art.",279,0.157
41,Machine Learning Job Interview Experiences,"Candidate experiences detailing ML/MLE interview pipelines: phone screens, OA, technical coding and theory, behavioral/leadership principles, team matching; typical questions, preparation tips, and handling feedback across rounds.",277,0.156
42,Responsible AI Use in Education,"Advocating integrating AI into schooling: teach students responsible, productive use; redesign assignments to reduce misuse; and retool classrooms and systems rather than banning or policing AI.",270,0.152
43,College Writing and AI,"Instructors outline strategies for structuring writing courses—short/long essays, process checkpoints, reflections, specific prompts, oral components, portfolios, and AI literacy—to promote authentic voice and limit generic AI-generated work.",249,0.14
44,Em Dashes in AI-Generated Writing,"Em dash usage patterns—spacing, consistency, overuse—linked to ChatGPT; AI shows uniform em dashes without spaces, unlike human writing’s mixed dashes, hyphens, or semicolons.",247,0.139
45,Accuracy and Use of AI Detectors in Education,"Debate over AI text detectors’ reliability: educators using multiple tools, frequent flags, confessions, and concerns about false positives prompting rewrites and questioning assumptions that detectors don't work.",247,0.139
46,Philosophy vs CS/AI/Cognitive Science Paths,"Undergraduates debating majors and PhD routes across philosophy, CS/AI, math, and psychology/cognitive science; considering ethics, impact, departmental fit (analytic vs continental), and job prospects.",240,0.135
47,AI Enthusiast Discord Community Invite,"Invitation to join a global, interdisciplinary Discord community for sustainable AI development, coding projects, knowledge sharing, and collaboration among students, professionals, and educators.",240,0.135
48,Python/NumPy Neural Network Implementation,"Building and debugging feedforward neural networks (XOR) with sigmoid activation, multiple layers, weight initialization, and backpropagation, plus tutorials and critiques of neural network methods.",239,0.134
49,PhD Needed for AI/ML Research Careers,"Consensus that AI/ML research roles typically require a PhD; a master’s is for learning, not enough for research-track jobs; corrects misconceptions about PhD paths.",238,0.134
50,Law Degrees and Careers,"Explores differences among JD, LLB, LLM, SJD; entry to practice versus academia; LLM routes for non-law backgrounds; and career and CV advice for law graduates lacking qualification.",227,0.128
51,AI-driven homeschool learning apps,"Homeschool parents/developers discuss personalized educational apps for kids—spelling, interactive stories, Quran memorization—using AI, spaced repetition, and progress tracking, seeking feedback on features, pricing, trust, and curriculum fit.",214,0.12
52,Chatbots and Conversational AI Development,"Overview of rule-based vs NLP chatbots; building and deploying via APIs and frameworks (Microsoft Bot Framework/LUIS), multi-channel integration, hosting, and implementation in C#/JavaScript using preset replies or machine learning.",208,0.117
53,AI in Student Writing,"Debate on AI in student writing: limits in scaffolding and synthesis, authenticity and ethics concerns, widening skill-perception gap, detection challenges, and rethinking writing instruction as AI becomes ubiquitous.",207,0.116
54,ChatGPT for Academic Writing Support,"Debates and guidance on using ChatGPT to refine grammar, tone, and structure in academic texts, acknowledging its limitations versus human writing and addressing ethical, institutional, and plagiarism concerns.",202,0.114
55,AI Plagiarism and Detection,"Guidelines and debates on whether AI-generated text constitutes plagiarism, institutional definitions including AI use, citation expectations, and reliance on plagiarism/AI detection tools.",194,0.109
56,Real-world GitHub Copilot effectiveness,"Users find Copilot helpful for boilerplate and autocomplete but prone to misguesses and subtle bugs, with limited productivity gains; usage metrics may overstate its true coding contribution.",192,0.108
57,Introduction to Machine Learning,"General discussion of machine learning concepts and algorithms, including linear regression and aggregation techniques; questions and remarks about what machine learning is and its uses.",182,0.102
58,Beginner Web Development Learning and Projects,"Beginners share self‑taught web development paths and project‑based learning, outlining resources and curricula while tackling HTML/CSS/JavaScript/PHP projects like e‑commerce sites and strategies to escape tutorial hell.",179,0.101
59,CS Job Market Pessimism Debate,"Debate over a professor’s pessimistic claims: CS oversupply, outsourcing, end of Moore’s law, AI hype, recession, education decline; rebuttals cite continued demand, innovation, and limits of cheap labor.",176,0.099
60,AI-Powered Assessment and Learning Platforms,"Posts introducing AI-driven education platforms offering personalized assessments, content creation, and interactive learning tools, targeting educators and learners and seeking feedback on features, scalability, and best practices.",175,0.098
61,CS and Data Science Majors/Minors Planning,"Exploring CS, Data Science, and Statistics academic paths: choosing majors/minors, double majors, program combinations, and internships; evaluating AI/ML overlap and advising CS major with stats minor over standalone Data Science.",174,0.098
62,Linear Algebra for Machine Learning,"Emphasizes linear algebra as the core framework for machine learning and beyond; understanding high-dimensional spaces, matrices, vectors, and some calculus (gradients) is essential for practical algorithms.",174,0.098
63,ML/DS Internship Resume Feedback,"Candidates seek feedback to refine resumes versus CVs to increase interview callbacks for machine learning, data science, and software development internships, especially for PhD students.",173,0.097
64,Environmental Impact of AI Data Centers,"AI data centers consume significant electricity and water, generating carbon emissions and e-waste. Their energy demand is additive, sparking debate over sustainability and even dedicated power sources.",171,0.096
65,Blockchain Hype and Skepticism,"Critical discussion mocking blockchain buzzwords and bandwagoning; questioning real-world adoption and utility, especially versus AI, and noting companies tout it mainly for hype and stock bumps.",170,0.096
66,Bioinformatics and Computational Biology Pathways,"Guidance on selecting majors, programs, and research focuses (CS vs biochem, BME vs CS, regeneration vs CAR-T) for careers in bioinformatics, computational biology, genomics, and precision medicine.",166,0.093
67,ChatGPT Citation Hallucinations,"Users report ChatGPT fabricates or misattributes citations and fails to produce proper in-text references, leading to inaccurate bibliographies; some suggest requiring precise citations to detect AI-generated academic work.",164,0.092
68,Rubrics to Penalize AI-Generated Writing,"Designing and applying grading rubrics to flag and penalize AI-like writing patterns, share criteria with students, and use professional judgment to distinguish genuine elevated prose from inflated AI-generated text.",164,0.092
69,CS vs EE vs CE: Degree and Career Paths,"Comparing CS, EE, and CE—curricula, hardware vs software focus, embedded systems, robotics/AI aims, job outlook, and paths like double majors or EE BS + CS MS for versatility.",163,0.092
70,Educational Burnout and Life Direction,"Students express depression and frustration with school, consider dropping out or alternative learning, struggle with parental expectations, majors and careers, and seek meaningful paths, motivation, and stability.",162,0.091
71,Medicine vs CS/AI Career Decisions,"Posts seeking guidance on choosing MD, MD‑PhD, or PhD/CS paths, balancing clinical care with research, and transitioning from medical school to computational/AI roles, including feasibility, skills, and outcomes.",158,0.089
72,GPT Model Preference and Superiority,"Conversation about using GPT, comparing it to other models, praising GPT as superior and recommending asking/using GPT over current alternatives.",157,0.088
73,ChatGPT and Professional Email Etiquette in Academia,"Using ChatGPT to draft and refine professional emails in academic settings, including etiquette instruction, professors’ reactions to AI-composed messages, and humorous or corrective responses to student communications.",151,0.085
74,AI and the Physician Workforce,"Debate on whether AI reduces physician demand; increases efficiency, shifts tasks, affects radiology/diagnosis, may expand complex surgeries; addresses overwork, training, and healthcare capacity.",150,0.084
75,Web Development Roles and Specializations,"Explains web development and its roles (frontend, backend, fullstack, DevOps, mobile), why it’s popular and accessible, skills and tools required, and contrasts with ML, embedded, and other engineering fields.",147,0.083
76,Hidden White Text in Assignments for AI Detection,"Using hidden white-font text in assignments to trap AI usage; examples, student deception, ethics, Canvas formatting limits, and practical detection or follow-up steps for academic integrity.",142,0.08
77,Stop using AI,"Messages urging people to stop or significantly reduce AI use, especially in learning and job tasks.",141,0.079
78,Student Use of Generative AI in Education,"Debate on student use of generative AI in education, including resistance in math, survey assumptions, and emerging policies (e.g., Japan) requiring prompt disclosure to assess understanding across cultures.",141,0.079
79,ATS and AI-Driven Resume Filtering,"Debate over ATS capabilities and AI/keyword filtering in hiring: concerns about AI-generated resumes gaming systems, misunderstandings about ATS features, prevalence of manual review, and risks of legitimate candidates being filtered.",139,0.078
80,Toxic PhD Supervision,"Grad students describe neglectful or exploitative advisors: lack of mentorship, isolation, credit hoarding, blocked opportunities and rescinded positions, causing demoralization, career uncertainty, and mental distress about academia.",135,0.076
81,"AI as Learning Tool, Not a Crutch","Users view AI as a helpful learning tool but emphasize critical thinking, verification, and active engagement. Don't blindly trust outputs; use AI to upskill, not replace thought.",134,0.075
82,Critique of LeetCode Interviews,"Discussion criticizing companies’ reliance on LeetCode-style coding problems in interviews; memorization, questionable effectiveness, and AI tools' impact on assessing candidates, especially for ML roles.",133,0.075
83,AI-Assisted Writing: Cheating or Legitimate Tool,"Debate on using AI in writing—some call it cheating, others defend AI as an editing/feedback aid akin to spellcheck or beta readers, improving learning, flow, and style amid stigma.",132,0.074
84,Generative AI Hallucinations and Reliability,"Discussion of generative AI hallucinations, their risks and detection, educational implications, and vivid examples like fabricated alligators in Svalbard and erroneous chatbot claims, emphasizing source-checking and limitations.",131,0.074
85,COVID-era schooling and AI,"Teachers reflect on pandemic learning loss and remote-teaching failures, warning against AI replacing classrooms; note students’ academic/social setbacks and mixed parental responses as schools readjust post-COVID.",127,0.071
86,AI’s Impact on Legal Careers,"Discussion on AI in law: human licensing limits lawyer replacement, support roles more automatable, saturated legal market, and guidance for law students to prioritize legal training over building AI.",125,0.07
87,"French education, retraining, and study tips","French-language discussions on education: tech career reconversion via bootcamps/École 42, teaching jobs and salaries in France, and practical study and memory techniques.",123,0.069
88,Machine Learning vs Deep Learning Trade-offs,"Explains AI, ML, and deep learning hierarchy; contrasts linear models with neural networks; discusses interpretability, resource constraints, data representation, training, and choosing deep learning versus simpler models.",121,0.068
89,Resume Optimization and Job Search Strategies,"Guidance on resume formatting and keyword tailoring, LinkedIn use, applying early, ATS/recruiter processes, and interview prep to improve hiring chances for students and job seekers.",119,0.067
90,Student final-year app and AI project ideas,"Guidance and idea lists for student final-year projects, focusing on app/web and AI/ML solutions across domains (VR/AR, health, education), with feasibility considerations and engineering use cases.",118,0.066
91,Otter.ai Transcription for Lectures & Meetings,"Users discuss using Otter.ai for transcribing meetings and lectures, its summaries/diarization, subscription limits, and seek accurate, high-volume, live transcription apps with long-term storage, preferably free or cheaper alternatives.",116,0.065
92,Frustration with AI Writing and Detectors,"Users vent that AI writing is lifeless; human writing, even flawed, is better. They distrust AI-detection tools, fearing harm to academic and legitimate writers and diminished joy in writing.",115,0.065
93,Comet Browser Referral for Free Perplexity Pro,"Guide to using Perplexity's Comet browser referral program to earn payouts per verified signup and get Perplexity Pro free; requires desktop, fresh Gmail, same Google account, track via Dub.",113,0.064
94,Law School Realities,"Anecdotal guidance on law careers: LSAT-driven admissions, non-elite paths, heavy debt, oversupplied jobs, tedious practice, bar exams; family’s JD/LLM/MBA trajectory into teaching/consulting; urge shadowing lawyers before committing.",111,0.062
95,LLM Hype vs AGI Prospects,"Debate over LLMs: skeptics argue hype, limited utility, and AGI insufficiency; practitioners counter with compound systems, RAG, specialization, and horizontal scaling beyond Moore’s law despite next-token limitations.",110,0.062
96,Debate Over AI Use as Cheating,"Discussion framing AI use in coursework as cheating, accusations and distrust, calls for clear rules and civility, and concerns about misuse, dishonesty, and broader ethical and environmental issues.",108,0.061
97,Fakespot Amazon Review Authenticity Analysis,"AI-powered Fakespot reports grading Amazon product reviews for authenticity, flags fake reviews and unreliable sellers, and provides adjusted ratings and trust grades, not assessing product quality.",107,0.06
98,Ethics of ChatGPT in Academic Writing,"Debate over whether using ChatGPT to structure or polish papers is unethical or plagiarism, and discussion of authorship credit for AI tools versus human contributors and traditional research software.",107,0.06
99,Anonymous AI-in-education survey recruitment,"Recruitment posts inviting students and educators to complete brief, anonymous academic surveys on AI/trust and assessment, with links, estimated minutes to complete, and thanks for participation.",106,0.06
100,AI Literacy for Kids,"Parents and educators promoting AI literacy for children: ethical, critical use, source evaluation, prompt quality; argue guidance and education, not resistance, will prepare kids as AI becomes ubiquitous.",105,0.059
