Topic,Topic summary,Topic description,Count,% of total corpus
-1,"Software career paths: CS vs ME, AI ambitions, and functional programming","Discussions on navigating CS versus mechanical engineering, building portfolios and testing rigor, exploring AI aspirations, and learning functional programming (Lisp/Clojure) to deepen software fundamentals and career readiness.",7819,53.303
0,Data Science Roles and Business Impact,"Distinctions among data scientists, data engineers, and analysts; skills, tools, education, ML focus, programming, and how teams deliver business value through automation, analytics, and decision-making",402,2.74
1,AI Automation’s Impact on Jobs and Programming,"Debate over AI automation replacing jobs: limits of current ML, disruption to workers and management, fewer entry-level roles, artistic impacts, and sustained need for human judgment and high-level design.",328,2.236
2,"ML Engineering vs Research: Roles, Skills, and Degrees","Debate on ML engineering versus research: duties, skills, and competitiveness; PhD often unnecessary for MLE. Paths via SWE/data engineering, startups, pipelines, deploying models, practical applications using existing tools.",223,1.52
3,Tic-Tac-Toe for Learning Programming Concepts,"Using Tic-Tac-Toe to explore scalable design, variable boards, custom rules, UI/web, AI (minimax/ML), persistence, networking, testing, and separation of concerns.",203,1.384
4,CS Master’s Worth: Industry vs Research,"Debating a CS master’s: valuable for research-heavy roles (ML/AI, robotics), often unnecessary for standard software jobs; weigh specialization, costs, lost salary, company sponsorship, and building experience via projects/internships",201,1.37
5,Developer Resume Optimization,"Advice on one-page resumes, surfacing key tech/buzzwords, quantified project bullet points, effective section ordering, and aligning LinkedIn to improve recruiter screening and responses.",165,1.125
6,Machine Learning Courses and Resources (Andrew Ng/Coursera),"Curated pathway to learn machine learning: Andrew Ng’s Coursera/Stanford courses, fast.ai, Kaggle practice, MIT OCW math, Caltech Learning from Data; resources from beginner to advanced.",147,1.002
7,Programming Project Idea Lists,"Curated collections of coding project ideas and project-based learning resources across languages and domains to practice, build apps, and improve skills.",135,0.92
8,Learning to Code: Paths and Beginner Strategies,"Guidance on starting programming—Python or web basics—comparing self-taught, bootcamps, and degrees, study tactics, projects, problem-solving, motivation, networking, and job-hunting tips.",126,0.859
9,"Software Job Offers: Salaries, Bonuses, and Relocation (Montreal/Remote)","Aggregated internship and entry-level software job offers detailing salaries, locations (Montreal, remote), titles, relocation packages, signing bonuses, and total compensation comparisons across companies.",111,0.757
10,Coding bootcamps vs self-study for tech careers,"Debate on coding bootcamps’ value versus self-study and networking for tech transition, industry perceptions by discipline, degree needs, online options, and critiques of programs like TKS emphasizing marketing over outcomes.",107,0.729
11,"C Language: Performance, Systems, and Ecosystem","Explores C’s strengths, limitations, and education trade-offs; its use in OS/compilers, GUIs, Android NDK; comparisons with Python/Java; performance vs productivity; libraries bridging C with high-level languages (e.g., NumPy).",104,0.709
12,CS and Research Summer Internships,"Guidance for students seeking summer internships: skills to build, projects, resume, timelines, cold-emailing professors for research roles, and strategies to apply without prior experience",97,0.661
13,"AI magic: API wrappers, JPA query methods, and self-awareness skepticism","Discussion of simple OpenAI API wrappers, Spring Data JPA’s method-name-derived queries, and doubts about AI meaning or self-awareness, questioning where the apparent magic and responses come from.",93,0.634
14,Online vs In‑Person Schooling and Teacher Effectiveness,"Debate over online versus in‑person schooling during COVID, emphasizing teacher quality, active learning, student support, safety, and access equity; argues teaching effectiveness transcends modality but needs training and infrastructure.",92,0.627
15,Natural Language Processing (NLP),"Computational techniques for analyzing and processing human language text, words, and sentences.",91,0.62
16,Math Requirements for Programming and CS,"Math needs vary by programming domain: basic arithmetic often suffices; data/AI and game dev require linear algebra, calculus, and statistics; CS degrees emphasize discrete math; skills improve with practice.",81,0.552
17,AI/ML Hype vs Reality and Job Market Saturation,"Practitioners debate AI/ML hype, noting incremental value, data-heavy plumbing work, title inflation, oversupply of candidates, and better opportunities in smaller, domain-focused firms rather than headline-grabbing projects",79,0.539
18,Job Search and Interview Strategies for New Grads,"Practical advice and statistics on applying, networking with recruiters, leveraging LinkedIn and job boards, tailoring resumes, self-learning projects, and thorough interview preparation to improve response rates and offers.",77,0.525
19,Academic publishing in computer science and open access,"Differences between conferences and journals, submission venues for software, and market shifts toward open access challenging Elsevier and traditional subscriptions.",77,0.525
20,Math and CS Foundations for Machine Learning,"Discussion of ML prerequisites: statistics, linear algebra, calculus, PCA; implementation considerations using libraries vs low-level CS skills; roles of programming, engineering practices, and industry expectations/interviews.",74,0.504
21,"Law school pathways, LSAT, and career realities","Family experiences via community college and state universities; intensive LSAT prep; JD/LLM/MBA and patent credentials; cautions about debt, job saturation, and the routine nature of legal practice.",72,0.491
22,UIUC vs UCSD for Data Science/CS Transfer Decision,"Freshman choosing between UIUC Stats+CS and UCSD Data Science, weighing CS rigor, access to upper-division courses, reputation, and career opportunities in data analytics, ML, and urban planning.",72,0.491
23,Discord programming communities for collaboration and learning,"Organized Discord servers connecting programmers for projects, tutoring, help channels, and team building with roles, GitHub integration, and Python/Java/C learning; join to collaborate and learn.",72,0.491
24,College Admissions Interviews (Penn-focused),"Guidance on scheduling and preparing for alumni/online interviews: research, answers, attire, logistics, questions, follow-up; plus a detailed student account of a Penn interview and feedback expectations.",68,0.464
25,Startup job offer decisions,"Weighing salary vs equity, risk, role seniority (CTO vs engineer), AI focus, remote work, and company stability when choosing between startup and consultancy offers.",67,0.457
26,Tech job market saturation and education ROI,"Debates on oversupply of entry-level CS roles, automation reducing demand, volatile salaries, and whether advanced degrees provide resilience versus non-PhD lifetime earnings in a maturing tech job market.",67,0.457
27,Computer Science Curriculum,"Personal histories and overviews of CS programs covering programming languages, data structures, algorithms, operating systems, compilers, AI, architecture, theory; balancing academic rigor with practical skills across decades.",67,0.457
28,AI vs ML: Definitions and History,"Debate clarifies AI terminology, contrasts with ML and autonomy, outlines history from symbolic AI to deep learning, and highlights practical subfields and uses.",66,0.45
29,"Practical ML and optimization for recipes, food CV, and supply chain analytics","Users seek guidance selecting tools (Python, CP-SAT, CV) to build data-driven recipe generators, food calorie estimators, and supply chain analytics, overcoming Excel limits, modeling choices, and framework frustrations.",65,0.443
30,"Linguistics, NLP, and Cognitive Science: Connections and Careers","Debate on linguistics’ ties to NLP and cognitive science, academic vs industry paths, interdisciplinary applications (TESOL, sociolinguistics), and job market realities for linguistics students and researchers.",65,0.443
31,STEM-focused high school juniors seeking college admissions guidance,"Profiles of juniors with strong STEM ECs, research, AP/SAT context, GPA concerns, limited school clubs; asking for college lists and reach/safety strategy including Stanford, UIUC, Michigan, affordability.",61,0.416
32,Choosing a Software Career Amid Tech Hype,"Students anxious about tech career choices, oscillating among technologies and fearing obsolescence; advice emphasizes fundamentals, teamwork, adaptability, mentorship, realistic goals, and aligning work with passion for building.",61,0.416
33,Ruby vs Python Popularity and Adoption,"Why Python eclipsed Ruby: stronger ecosystem, data science libraries, educational adoption, job-market momentum; despite Rubys syntax appeal and performance advances, both languages overlap in purpose and web frameworks",60,0.409
34,Post-grad career pivots: CS vs finance/accounting,"Recent graduates weigh second degrees, CPA eligibility, and transitions between CS, finance, and biotech, seeking practical, well-paid roles, work-life balance, and contingency plans during gap years.",60,0.409
35,Next Big Thing in Software Engineering: Blockchain vs AR vs AI/ML,"Developers debate the next in-demand field, weighing blockchain and augmented reality against enduring AI/ML, considering adoption, growth, and career strategy amid industry saturation and hype.",59,0.402
36,"CS vs CE/ECE major decision for AI/ML, cybersecurity, and hardware interests","HS senior seeking guidance on CS vs CE/ECE majors and schools to balance AI/ML, bioinformatics, cybersecurity, and hands-on circuitry/robotics without being confined to pure coding or hardware.",56,0.382
37,AI/ML Education and Degree Planning,"Guidance on pursuing AI/ML careers: prioritize broad CS/math foundations, consider minors and self-study; graduate study often needed; plan coursework, finances, and long-term learning over specialized undergraduate AI degrees.",56,0.382
38,Loss Functions and Training for Custom Neural Networks,"Guidance on selecting loss functions, required inputs/outputs, interpreting returns, and improving custom neural network modules; addresses prediction disagreements and training considerations.",56,0.382
39,Starting AI with Python: prerequisites and resources,"Aspiring coders seek paths into AI: start with Python, solidify math basics, learn PyTorch/TensorFlow, take beginner courses (Harvard CS50 AI, DeepLearning.AI), build projects.",55,0.375
40,ML color matching and weather-based clothing app,"Designing a user app using ML to predict color matches and outfit choices from weather APIs, with Python/JS stacks, labeling, model serialization, and interactive UI for data collection.",53,0.361
41,Value of Online Certifications (Coursera) for CS/Data Science Paths,"Evaluating Coursera and online certificates: credibility with employers/admissions, proof of completion, alternatives (projects, internships), choosing CS vs data science, essential skills, and cost-effective pathways.",50,0.341
42,Physics-to-AI/CS Career Transitions and Interdisciplinary Research,"Physics students/PhDs weighing moves into AI/CS, exploring quantum information and theoretical CS, grappling with relevance, training gaps, and strategies (self-study, advisors) for interdisciplinary academic or industry research.",45,0.307
43,Online Exam Proctoring and Privacy,"Debate over AI proctoring: student privacy, false flags, accessibility; instructors’ perspectives, room scans, anti-cheating measures, and alternatives like open-book or original assessments.",45,0.307
44,Deciding between tech internship offers,"Students compare summer internships at IBM, Capital One, Microsoft, Facebook, Prudential, and an ML firm, weighing role fit, pay, location, prestige, and return-offer potential.",44,0.3
45,"Machine Learning Hype, Fads, and Practical Engineering Realities","Critical discussion of ML hype cycles, transient trends versus durable methods (transformers), practitioner reliance on wrappers/AutoML, inefficiency and power/cost concerns, and the gap between theory and real-world utility.",44,0.3
46,Python Data Science Learning Resources,"Recommendations for learning Python-based data science: Udemy and edX/MITx courses, key books (Grus, McKinney), tools (Jupyter, Kaggle), visualization, statistics, and career tips.",44,0.3
47,AI research in academia: student queries and lost algorithm lore,"Students email professors and visit office hours seeking AI research experience; includes an anecdote about a professor pursuing a vanished, overhyped algorithm paper.",43,0.293
48,"Degree requirements, masters value, and US–EU education differences","Discussion on US vs EU university costs and rigor, masters necessity for advanced tech roles, employer degree verification, and stigma of general studies versus specific majors like criminal justice.",43,0.293
49,Full-Stack vs Generalist in Web Frontend,"Debate over full-stack versus generalist definitions and the value of algorithm-heavy skills in web/frontend roles, arguing most frontend work needs clean code over advanced CS, unlike specialized engineering.",42,0.286
50,AI’s Impact on Doctors and Surgery,"Debate on AI reducing doctor demand versus boosting efficiency, shifting focus to complex cases, expanding surgical capacity, easing shortages, and augmenting CT/X-ray imaging diagnosis.",42,0.286
51,"AI PhD decisions: career, lifestyle, and funding trade-offs","Pros and cons of pursuing an AI-focused PhD, including career timing, salary, research vs application, advisor choice, funding, teaching, mental health, relationships, and policy impact",42,0.286
52,Cybersecurity and Machine Learning Career Paths,"Guidance on entering cybersecurity vs machine learning, overlapping skills, networking knowledge, product security roles, SWE in security companies, ML applications in security, and management-oriented career paths.",42,0.286
53,GPT for Language Learning and AI Dungeon,"Discussion of using OpenAI GPT transformer models to automate sentence generation for language learning and powering AI Dungeon; addresses multilingual capability, model impressiveness, and tool integration.",41,0.28
54,Beginner Computer Vision Concepts and Projects (Python/MATLAB),"Explains foundational image processing—pixels, color spaces, segmentation, shape detection—and discusses practical project ideas (e.g., shiny Pokémon detection), libraries (OpenCV), and tooling across Python/MATLAB/emulators",40,0.273
55,Machine Learning in CFD and Computational Chemistry,"Debate on applying ML/deep learning to CFD and chemistry: speed vs interpretability, generalization, curve-fitting critiques, compressed sensing, graph-based thermochemistry, and the need for rigorous methodology over hype.",38,0.259
56,CS Double Major/Minor Decisions for AI/ML Careers,"Students weigh CS double majors or math/psych minors, workload, extra semesters, overlapping requirements, internships, and accommodations to prepare for AI/ML, data science, and software engineering.",37,0.252
57,Budget coding laptop choices: Linux PC vs MacBook,"Guidance on choosing budget coding laptops: prefer Linux PCs over MacBooks; prioritize RAM, SSD, and screen size; most dev tasks run on modest hardware; deep learning may need GPU.",35,0.239
58,US Big Tech Products and Chinese Student Immigration Debate,"Discussion comparing big tech product quality and priorities, alongside debates over Chinese students, H-1B immigrants, national security, brain drain, and US immigration policy impacts on innovation.",34,0.232
59,AI Ethics and Social Media Manipulation,"AI ethics and safety debate: profit-driven social media algorithms reshape user preferences for predictability, amplifying political polarization and bias, underscoring needs for responsible design, profitability-aligned ethics, and scholarly rigor.",34,0.232
60,Choosing Unpaid vs Paid Internships,"Guidance on weighing unpaid versus paid internships: prioritize mentorship, project relevance, and finances; consider personal or open-source projects; avoid data entry; remote options exist; quitting unpaid roles is acceptable",32,0.218
61,ML/Data Science Education and Career Transition,"Learner with C/Python and embedded experience explores ML/data science projects, seeks transferable skills, and considers University of London Coursera CS degree for industry opportunities",32,0.218
62,"Race, Diversity, and Pay Equity Debates in HR","Online arguments over racism and political correctness intersect with HR pay ranges, market data, transparency, negotiation, and efforts to address underpayment among historically disadvantaged gender and racial groups.",31,0.211
63,Free Coding Resources and Exercises for Beginners,"Curated lists of free courses, coding exercises, and algorithm practice platforms for beginners learning programming (Python, JavaScript, etc.), including interview prep, front-end tools, and developer utilities.",31,0.211
64,Self-Taught Pathways into AI/ML and Robotics Careers,"Aspirations for impactful, hands-on AI/ML and robotics roles at startups; guidance on math fundamentals, coursework, practice hours, and degree vs self-learning tradeoffs.",30,0.205
65,OMSCS and Online CS Masters vs OSU Post‑Bacc,"Debate over pursuing Georgia Tech OMSCS or similar online CS master’s versus OSU post‑bacc, admissions readiness, GRE, employer sponsorship, and equivalence/value of online versus on‑campus CS degrees.",30,0.205
66,Interdisciplinary Computational and Cognitive Neuroscience Careers,"Overview of neuroscience and cognitive science subfields, training paths, and skills, emphasizing computational methods and career outcomes across academia, data science, biotech, health, and related industries.",29,0.198
67,ATS and HR Resume Screening Process,"How resumes are filtered by ATS keywords and HR against job descriptions, then prescreened by recruiters before hiring managers review; inconsistencies, writing clarity, and credentials influence candidate selection.",29,0.198
68,"Programming language choices and career advice (JavaScript, PHP, Python, Java)","Discussion on choosing languages for developer careers—JS/TypeScript for web, Python for data/AI, PHP experience and switching considerations—job market trends, learning paths, and balancing specialization versus adaptability.",29,0.198
69,AI/ML Learning Resources: fast.ai vs Andrew Ng (Coursera),"Comparing fast.ai and Andrew Ng’s Coursera ML courses, with mentions of Oxford/UC intros; recommendations for beginners and notes on transcription quality.",28,0.191
70,Cambridge Math vs NUS CS Path to Top MS CS/AI,Singaporean national serviceman weighing Cambridge Mathematics plus NUS CS background versus NUS CS degree to best position for admission to top MS CS/AI programs (Stanford/MIT/CMU).,27,0.184
71,NLP and Rule-Based Chatbot Development in .NET,"Designing and deploying rule-based and NLP chatbots in C#/.NET with Dialogflow/Wit.ai, keyword triggers, webhooks, and social media/Discord integration for automated responses and intent-driven workflows",27,0.184
72,Game Development Careers and DS/ML Projects,"Discussion of game development roles, required C/C++ and math/AI skills, pathfinding and systems knowledge, and the hiring value of DS/ML game projects during internships and job searches.",27,0.184
73,"Creating Accessible Lecture Videos: Zoom, Canvas Studio, Otter.ai","Guidance on recording and uploading lecture videos, adding captions/transcripts via Otter.ai, leveraging Canvas Studio/YouTube, and improving delivery with visual summaries, whiteboard/pad techniques, minimal background music.",26,0.177
74,Deep Learning Path and Prerequisites,"Guidance on choosing Andrew Ngs ML then DL courses versus Goodfellows book, emphasizing math foundations (calculus, linear algebra, probability) and practical projects and systems understanding",25,0.17
75,"Python-based AI for Games, Robotics, and Critical Care","Discussions on using Python to build AI bots, robotic control with IR readings, and medical decision-support for drug dosing; language choices, tools, and security considerations.",25,0.17
76,Indian AI Startups Landscape and Career Guidance,"Discussion and overview of Indian AI startups, notable companies, funding, applications, and advice for joining an early-stage AI startup and assessing product-market fit, competition, and sustainability.",25,0.17
77,"Depression, motivation, and career direction","Personal accounts of depression, anxiety, and lost motivation, seeking purpose and career direction, balancing passions (CS, boxing) with practical constraints, and applying self-help strategies (sleep, exercise, meditation) to recover.",25,0.17
78,Python as high-level wrapper for C/CUDA ML libraries,"Discussion on using Python for productivity while critical compute runs in optimized C/CUDA/Fortran libraries (e.g., ML frameworks); optimize bottlenecks; language trade-offs in speed vs readability.",25,0.17
79,Choosing a First Programming Language: Python vs JavaScript vs Java,"Discussion comparing Python, JavaScript, and Java for beginners: setup ease, libraries, career relevance, learning paths; advocates starting with Python, adding JavaScript later, and exploring lower-level languages for fundamentals.",25,0.17
80,Healthcare Professionals Transitioning to AI/Data Science and Health Informatics,"Discussions by healthcare workers exploring AI, data science, and health informatics careers: realities of EHR/software work, burnout-driven transitions, leveraging clinical domain expertise for tech roles and entrepreneurship.",24,0.164
81,Robotics and Electrical Engineering Learning Roadmap,"Guides for aspiring robotics/EE students: learn ROS, C/C++/Python, MATLAB, control, electronics, embedded, PCB/CAD, Linux, PLC/networking, simulation, safety/security, and essential soft skills like project management and conflict resolution.",24,0.164
82,Internship Choices for Data Science/SWE Careers,"Students weigh technical vs non-technical summer internships (data science, SWE, quant) and their impact on post-graduation career prospects.",24,0.164
83,International Graduate Program Selection in Europe (Germany),"Applicants seek advice on selecting European masters vs PhD programs (finance, CS/cognitive), program rigor, visa sponsorship, and career alignment, focusing on Germany and top universities",23,0.157
84,AWS/GCP Solutions Architect vs Cloud Consultant Roles,"Differences between strategic SA roles and hands-on cloud consultants/engineers: responsibilities, client delivery, coding, DevOps/serverless, specialization, skills emphasis, work-life variability.",23,0.157
85,"Learning Python Beyond the Basics: Resources, Projects, and Practical Guidance","Curated resources and advice for progressing from Python basics to intermediate skills, including tutorials, exercises, projects, command-line setup, book recommendations, and real-world problem-solving strategies.",22,0.15
86,"Burnout and search for meaningful, autonomous work","Front-end dev feeling disconnected from company work, burnout from deadlines; seeking autonomy, resonance, and meaning—considering resignation to pursue indie maker or open-source ideas; asking experienced devs for advice.",22,0.15
87,"Choosing JS/TypeScript, Java, or Python for UI, backend, and AI","Discussion comparing JS/TypeScript (UI, Node/serverless), Java (performance, big data), and Python (readable, data science/ML), outlining strengths, libraries, threading, and deployment considerations when choosing a language",22,0.15
88,Bioinformatics Careers and Industry Outlook,"Pathways and prospects in bioinformatics/computational biology: roles using sequencing and ML, education choices (CS/bio minors, masters), salaries in biotech vs pharma, and industry trends favoring tech-biotech hybrids.",21,0.143
89,CS vs Math for Machine Learning,Debate emphasizing ML education and research primarily in CS/stats departments; math is useful but math departments rarely offer advanced ML courses; recommend CS for ML pathways.,21,0.143
90,"Cloud career paths with AWS, Azure, and GCP","Guidance for web developers on cloud roles—app development, data analytics, and ops/automation—comparing AWS/Azure/GCP services, big data stacks, Kubernetes, certifications, and starting skills.",21,0.143
91,AI Careers and Practical Impact,"Entering AI engineering or research, low barriers via tools/datasets, emphasizing practical user benefits through automation and recommendation systems.",21,0.143
92,COVID-era Grades and Mental Health in Academia,"Experiences and advice on academic performance, pass/fail grading, and mental health during COVID, including graduate students struggles, GPA pressures, and considerations for transferring or career shifts.",21,0.143
93,Creative Design vs ML/CS Career Choices,"Young professionals debate pursuing machine learning/computer science or UX/3D design, considering competitiveness, education, pay, stability, freelancing, and combining creative passions with practical career paths.",20,0.136
94,"Web scraping: methods, ML challenges, and legal considerations","Discussion on scraping legality, building aggregation tools, and difficulties using machine learning to parse product pages versus traditional algorithms; guidance for beginners considering feasibility and alternatives.",20,0.136
