Topic,Topic summary,Topic description,Count,% of total corpus
95,Advisor Pressure for Incremental Papers in Image Segmentation,"EE PhD students frustration with advisor promoting incremental cockroach papers; debating trivial feature-initialized CNN for speckled imagery segmentation versus pursuing principled, domain-informed methods.",20,0.136
96,Early-career tech graduates: job search setbacks and upskilling decisions,"Graduates in electronics/data fields face layoffs, visa limits, and COVID disruptions; struggle to land developer roles, consider upskilling or master’s while battling anxiety and prolonged job gaps.",20,0.136
97,CS–Humanities Integration and AI-Driven College Admissions,"Debates on liberal arts’ value for CS students, pushes for computational collaboration in humanities, and critiques of AI-shaped admissions that incentivize specialization and gameable earnestness.",20,0.136
98,Orientation post-bac en informatique et pratiques d’enseignement des langues,"Conseils sur les parcours DUT/prépa/université pour l’informatique en France et retours d’expérience sur l’enseignement des langues (FR/IT/EN), méthodes ludiques, ressources, et admission aux grandes écoles.",20,0.136
99,"MATLAB vs Python: Toolboxes, Simulink, and Performance","Debate over MATLAB’s paid toolboxes and Simulink integration versus Python’s open-source ecosystem; interpreter speed seldom limits work thanks to NumPy/SciPy/Pandas, PySpark/Scala bindings, and ML frameworks like TensorFlow/PyTorch",20,0.136
100,"Math Degrees, Research, and Tech Careers","Debate on mathematics education and careers: viability of a math bachelors for software/data science, required skills versus CS, and insights on research culture, AI/ML limits, and long-term prospects",20,0.136
101,Web Development Burnout and Shift to DevOps/SRE,"Developers frustrated by frontend framework churn and full-stack demands consider transitioning to DevOps/SRE/cloud architecture, leveraging backend experience, certifications, and infrastructure interests amid market saturation.",19,0.13
102,Data Science vs. Machine Learning Roles,"Clarifies the distinction and overlap between data science and machine learning, noting differing skillsets and common role conflation.",19,0.13
103,Beginner TensorFlow for web and Raspberry Pi mask detection,"Guidance for beginners on TensorFlow integration for web apps and Raspberry Pi projects, including mask/object detection on live camera, hardware choices, TF vs TF.js/Django, and learning resources.",19,0.13
104,Learning strategies and time management for data science/ML,"Balancing work and study using evidence-based techniques—chunking, spaced repetition, retrieval practice, focused/diffuse modes—and project-based planning to optimize time, maintain momentum, measure progress, and reduce procrastination.",18,0.123
105,Workplace dissatisfaction and career transitions,"Experiences of dissatisfaction with managers and teams, tedious tasks, unclear roles, poor onboarding, capped pay, prompting career changes toward better pay, growth, work-life balance, and meaningful technical challenges.",18,0.123
106,Private-Sector ML/Computer Vision Research Careers,"Discussion of private-sector research roles in ML/computer vision: scarcity, competitiveness, PhD advantage, applied focus, internships, patents/publication, pay dynamics, startups vs big R&D, career strategies.",18,0.123
107,Udacity Deep Learning Nanodegree Mentorship and Value,"Students discuss course rigor, PyTorch projects, timelines, and job relevance, while criticizing abrupt mentorship removal, support quality, pricing, and transparency, questioning overall value.",18,0.123
108,Computer Vision Sensors and Applications,"Discussion of computer vision and sensors for object identification, pose estimation, and distance/angle computation, with applications in cameras, VFX, computational photography, and retail scanning systems",17,0.116
109,"AI-powered PDF summarization, flashcards, and Zotero annotation workflow","Using AI tools to summarize books, generate questions/flashcards, export PDFs, and integrate/sync annotated PDFs within Zotero for a fully digital research reading and management workflow.",17,0.116
110,"Legal career transitions and education pathways (JD/LLM, Canada)","Discussions on transitioning into law, JD/LLM and doctorate paths in Canada, non-bar legal careers, competitiveness, pay, internships, and aligning interests like human rights and AI regulation with viable roles.",17,0.116
111,JavaScript/Node.js vs Python (Flask/Django) for Web Development,"Advice on learning paths emphasizing JavaScript/Node.js for full‑stack web and app development, comparing with Python frameworks, considering tools, interviews, and entrepreneurship/product goals.",17,0.116
112,"Software and Systems Development, QA, and Robotics Automation","Comprehensive software and systems development—spanning OS, desktop apps, QA, and robotics automation—plus collaborative lab practices using shared repositories and selective uploads to enable developer access and reuse",17,0.116
113,"Hobbyist AI Architecture: Personality, Mood, Memory, and Practical ML","Discussions on building a personal AI system with mood, personality, and memory; practical tips for implementing ML models (YOLO, convnets), data cleaning challenges, and project feasibility for solo developers.",16,0.109
114,Transition to Backend/Full‑Stack Engineering,"Developers moving from game or frontend to backend seek languages, resources, projects, and roles; addressing system design, microservices, scalability, interviews, and remote job marketability.",16,0.109
115,"Emerging STEM Subfields: AI/Data Science, Biomedical, and Electrical Power Systems","Discussion of emerging STEM subfields—AI/data science, biomedical/mechatronics, and electrical engineering—from PCB design and communications to power generation/transmission, plus shifting job trends and funding (e.g., epidemiology/COVID).",16,0.109
116,AI-Assisted Grading Consistency and Anchoring Bias,"Debate on AI-assisted grading tools (e.g., Gradescope) enabling rubric updates and error clustering, versus inherent subjectivity, anchoring bias, fairness concerns, and current limitations of automated grading.",16,0.109
117,CS Faculty Hiring/Applications (Robotics/ML),Applying to tenure-track CS roles in Canada; recruiting professor for Data Science for Public Policy in Berlin.,16,0.109
118,"Scikit-learn basics: CSV parsing, train/test split, and DummyClassifier errors","Issues reading semicolon-delimited CSVs, Python indentation mistakes, proper train/test splitting, and fixing DummyClassifier most_frequent strategy errors due to target shape and preprocessing.",16,0.109
119,Guidance for aspiring quantum computing/AI researchers,"Advice on coursework, research, PhD applications, managing hype, and combining interests with cybersecurity and distributed systems; resources, mentorship, and overcoming impostor syndrome.",16,0.109
120,r/learnprogramming Automoderator notice on code screenshots and formatting,"Bot warns posters against code screenshots, urges proper formatting, no reposts, and to contact moderators if needed.",15,0.102
121,Rethinking Software Engineering Interview Practices,"Debate over software hiring: leetcode standardization vs domain-specific, practical evaluations. Argues for tailored loops, real-world tasks, trial work, acknowledging costs, tradeoffs, and candidate experience",15,0.102
122,Transitioning to Software Engineering and ML Careers,"Professionals shifting from PM, business, and data science to SWE/ML seek guidance on skills, portfolios, degrees, compensation, and pathways—including NYC and FAANG—favoring backend/data, automation, and leadership trajectories.",15,0.102
123,"Choosing Programming Languages for Web, Backend, and AI","Guidance on selecting programming languages—favoring Java, Python, and JavaScript—based on interests and domains like web, backend, AI/ML; start with one language, then expand",15,0.102
124,Programming languages and proficiency for AI/ML,"Discussion on how well one must know programming, choosing languages for AI/ML—primarily Python, with R/Scala/SQL—and when low-level C/C++ matters for performance; learning path suggestions.",15,0.102
125,CS vs Software Engineering (and Computer Engineering) Degrees,"Comparison of CS, Software Engineering, and Computer Engineering degrees: theory vs practice, specialization/accreditation differences, tooling focus, and career implications; most roles overlap, internships/co-ops crucial.",14,0.095
126,Foundational Mathematics in Computer Science,"How calculus, geometry, linear algebra, and discrete math underpin algorithms, machine learning, vectors, and cryptography; foundational math skills transfer broadly despite unpredictable applications.",14,0.095
127,AI/ML vs Web Development Careers,"Weighing specialization: AI/ML demands advanced degrees; blockchain is overhyped; web dev has more roles but saturation. Guidance: avoid hype, focus fundamentals, pursue entry-level experience",14,0.095
128,AI recruiting practices and job scam concerns,"Candidate experiences with AI-enabled recruitment firms, automated data mining, arduous interviews, and skepticism toward text-only offers, equipment purchases, and e-checks; caution about too-good-to-be-true job opportunities.",13,0.089
129,Fakespot AI Amazon Review Authenticity Analysis,"AI-driven evaluation of Amazon product reviews, detecting fake feedback and unreliable sellers, assigning trust grades and adjusted ratings to guide consumers on review and seller credibility.",13,0.089
130,Boston AI/ML Jobs: Routable AI Hiring Amid Layoffs,"Early-stage, VC-backed Routable AI hiring remotely for vehicle routing; simultaneous layoffs in Boston AI community, with data/ML and CV engineers seeking roles after pandemic-related cuts",13,0.089
131,"Programming language selection and learning paths (Python, JavaScript, Java, HTML/CSS)","Guidance on selecting a programming language based on goals—web, mobile, software, games, data science—emphasizing Python, JavaScript, Java, HTML/CSS, and learning paths, tools, and frameworks",13,0.089
132,"CPU/GPU/TPU roles, multithreading, and ML use","Differences between CPU, GPU, and TPU, multithreading constraints, gaming bottlenecks, and exploring GPU use for machine learning beyond Python.",13,0.089
133,"UK vs Hong Kong tech careers: visas, hiring, pay, and cost of living","Relocating for CS roles, UK visa routes, interview expectations, salaries versus London rent, and tech culture comparisons between UK/EU and Hong Kong.",12,0.082
134,CS Learning Paths and Career Advice,"Guidance on self-teaching vs college CS, foundational topics, adapting to commercial development, building projects, networking, managing burnout, and strategies for entering machine learning or software careers",12,0.082
135,Transitioning to AI/ML for Graduate Study,"Students with EE/CS backgrounds switching to AI/Computer Vision, debating CS vs ML master’s, second BSc, foundational gaps, advisor changes, and PhD application implications.",12,0.082
136,Master’s thesis topic selection strategies,"Advice and strategies for generating, refining, and selecting research ideas and proposals for masters theses, including literature review, advisor input, cross-disciplinary learning, and practical constraints.",12,0.082
137,CS Career Outcomes vs School Prestige,"Prestige helps but is secondary; specialized CS programs (e.g., Georgia Tech, UW, UIUC) often excel, and experience, research, internships, and effort drive outcomes more than school name.",12,0.082
138,Switching Graduate Advisors and Lab Fit,"Students weighing advisor/lab changes due to mismatched research focus, toxic supervision, limited mentorship, funding/security concerns, reference risks, and career impact when pursuing ML versus niche fields",12,0.082
139,"Dev Roadmap: Web, Mobile (Android/iOS), Desktop","Guidance on selecting focus areas and mastering tech stacks—JavaScript/React, React Native, Swift/Kotlin, Python—for web, cross-platform mobile, and desktop development, with recommended learning sequences and tools.",12,0.082
140,Math and Coursework Foundations for AI,"Guidance on core math and CS coursework for AI—calculus, linear algebra, probability, differential equations, statistics, algorithms—and study paths from introductory classes to advanced research preparation",12,0.082
141,NLP PhD Admissions Anxiety and Decision-Making,"Applicants discuss imposter syndrome, nontraditional preparation, SOP/letters, and whether to pursue PhD programs versus industry in ML/NLP, seeking advice to strengthen candidacy and avoid first-year pitfalls.",12,0.082
142,Value of CS Degrees vs Self-Learning (CUNY vs WGU),"Debate on CS degrees versus self-learning: projects, internships, and networking over certifications; CUNY seen as better industry preparation than WGU; emphasis on practical web/dev skills and career pipelines",11,0.075
143,CS Student Course Strategy for Data Science,"CS junior with Coursera access weighing breadth versus depth: pursue many CS courses or specialize in data science/ML; already strong in Python, with web dev and Excel basics",11,0.075
144,CS Specializations and Career Planning,"Advice on CS vs software engineering, choosing systems or AI/ML specializations, value of internships, graduate degree needs, and competitive job market with varied salaries.",11,0.075
145,Blockchain: Hype vs Practicality and Jobs,"Discussion critiques blockchain as overhyped buzzword, often unnecessary for businesses; highlights developer demand, AI tie-ins, ICO/legal pitfalls, and limited need for decentralization, trustlessness, or publicity.",11,0.075
146,"ML and Grad School Prep: Stats, Programming, NVIDIA GPUs",Importance of stats/probability and programming; NVIDIA GPU access aids ML/computer vision projects; useful for research and grad school preparation,11,0.075
147,GPA vs Research in CS/ML Admissions and Internships,"Students worry about low GPAs; upward trends plus strong research and letters can outweigh grades for grad admissions and tech internships; focus on research, key coursework, and context.",11,0.075
148,Python uses and versatility,"Python’s friendly syntax and rich libraries enable automation, scripting, data science/ML, backend web development, web scraping, bots, and even desktop or embedded applications.",11,0.075
149,Linear Algebra: Foundations and Applications in Computing and Science,"Linear algebra underpins machine learning, graphics, differential equations, optimization, simulations, and cryptography; matrices enable practical computation, making linear algebra foundational across math, statistics, physics, and programming.",11,0.075
150,Self-Taught CS Roadmap with MIT OCW and Systems Focus,"Guides for self-taught computer science study: language foundations, data structures, algorithms, architecture, operating systems, networking, databases; leveraging MIT OCW and courses; practice and career preparation.",11,0.075
151,Beginner CS Learning Roadmap and Summer Programs,"Guidance for high school students: foundational CS, AI/ML, web/systems tracks, recommended MOOCs, tools (git, editors), developer roadmaps, hackathon prep, and intensive summer course/program suggestions.",11,0.075
152,Indian CS master’s choices: McGill/Mila vs UMass/UCSB; Canada vs USA; research vs non-thesis,"Indian applicants comparing McGill/Mila, UMass, UCSB; Canada vs USA; research vs non-thesis; CGPA conversion, 3-year degree eligibility, costs, cohort size, and job prospects",11,0.075
153,Degrees vs Skills in Tech Career Transitions,"Discussion of qualifications for engineering, software, data, and teaching roles; value of degrees vs certifications; job-search strategies; and graduate CS/ML students navigating interviews, career goals, and role fit.",10,0.068
154,Junior Software Dev Interviews and Projects,"Advice for aspiring junior software developers: prioritize data structures/algorithm practice, maintain simple GitHub projects, focus on problem-solving and communication; recruiters screen resumes, juniors receive guidance and training.",10,0.068
155,"Lucrative Tech Career Niches: VR/AR, Cybersecurity, and Finance Tech","Advice on high-paying, less-saturated paths: VR/AR (VFX, computer vision), cybersecurity, finance-focused Java/C, big data/cloud, and niche specializations, cautioning AI/ML saturation and advocating combining AI with security.",10,0.068
156,Computational Cognitive Science and Human-Centered AI,"Exploring interdisciplinary graduate paths linking CS/AI, psychology, linguistics, and philosophy to study human cognition and design conversational agents for mental health support (depression), emphasizing understanding humans via AI theories.",10,0.068
157,"English spelling, phonics, and reform","Debate on English spelling irregularities, homograph disambiguation, phonics-based reading instruction, historical consonant doubling and ee spelling issues, and prospects for spelling reform and educational strategies.",10,0.068
